Facility ID,License Number,State Facility Type 1 Literal,Facility Name,Address,City,State,Zip Code,County,Phone Number,Licensee,Capacity,Ownership Type
11964687,9191,Assisted Living Facility,ELMCROFT OF TIMBERLIN PARC,7620 TIMBERLIN PARK,JACKSONVILLE,FL,32256-5407,Duval,(904) 519-9300,EC OPCO TIMBERLIN PARC  LLC,62,For-Profit
11969667,13435,Assisted Living Facility,ELOHIM ADONAI HOME,20121 NW 43RD AVE,MIAMI GARDENS,FL,33055,Miami-Dade,(786) 565-9625,Elohim Adonai Home INC.,6,For-Profit
11910910,5260,Assisted Living Facility,ELPA HOME CARE CENTER,9950 SW 83RD ST,MIAMI,FL,33173-4012,Miami-Dade,(305) 596-3824,Elpa Home Care Center INC,6,For-Profit
11910251,6056,Assisted Living Facility,EMBASSY INDIAN OAKS LLC,11355 131ST ST,LARGO,FL,33774-4716,Pinellas,(727) 593-0403,Embassy Indian Oaks  LLC,52,For-Profit
11963798,8668,Assisted Living Facility,EMBASSY RETIREMENT HOME OF MARGATE,6093 NW 9TH CT,MARGATE,FL,33063-3661,Broward,(954) 972-5600,EMBASSY HOME CARE  INC.,35,For-Profit
11965659,9997,Assisted Living Facility,EMERALD GARDENS INC,2159 MCMULLEN BOOTH RD,CLEARWATER,FL,33759,Pinellas,(727) 669-5014,EMERALD GARDEN INC,20,For-Profit
11967671,11667,Assisted Living Facility,EMERALD GARDENS PROPERTIES  LLC,1012 N 72 AVENUE,PENSACOLA,FL,32506,Escambia,(850) 458-8558,EMERALD GARDENS PROPERTIES  LLC.,55,For-Profit
11967156,11261,Assisted Living Facility,EMERALD HILLS,8717 GREENFIELD LN,ZEPHYRHILLS,FL,33541-7466,Pasco,(813) 355-4934,CONSORCIA MENDOZA,10,For-Profit
11964990,9431,Assisted Living Facility,EMERALD PARK OF HOLLYWOOD,5770 STIRLING RD,HOLLYWOOD,FL,33021-1549,Broward,(954) 987-5400,EMERALD PARK ALF LLC,100,For-Profit
11967356,11412,Assisted Living Facility,EMMANUEL CARE ASSISTED LIVING FACILITY,3628 DAISY AVE,PALM BEACH GARDENS,FL,33410,Palm Beach,(561) 627-3674,EMMANUEL CARE ALF INC,6,For-Profit
11969268,13089,Assisted Living Facility,EMMANUEL CARE ASSISTED LIVING FACILITY II,4385 FLAX CT,PALM BEACH GARDENS,FL,33410,Palm Beach,(561) 660-6601,EMMANUEL CARE ALF INC,6,For-Profit
11968706,12618,Assisted Living Facility,ENCORE AT AVALON PARK,13798 CYGNUS DR,ORLANDO,FL,32828,Orange,(407) 270-7500,AVALON SH MANAGEMENT  LLC,110,For-Profit
11966840,10968,Assisted Living Facility,ENGLISH ESTATES ASSISTED LIVING FACILITY INC,1340 OXFORD RD,MAITLAND,FL,32751,Seminole,(407) 483-2546,ENGLISH ESTATES ASSISTED LIVING FACILITY INC,6,For-Profit
11969263,13076,Assisted Living Facility,ENTRUSTED CARE ALF AT HEATHROW,405 KIMBERLY CT,SANFORD,FL,32771,Seminole,(407) 802-6001,THE SEVILLENO GROUP LLC,6,For-Profit
11910916,5839,Assisted Living Facility,EPWORTH VILLAGE RETIREMENT COMMUNITY,5300 W 16TH AVE,HIALEAH,FL,33012-2104,Miami-Dade,(305) 556-3500,ALDERSGATE RETIREMENT  INC,200,Not-For-Profit
11967883,11880,Assisted Living Facility,ERIKA'S HOUSE ALF,8301 N GOMEZ AVE,TAMPA,FL,33614-2814,Hillsborough,(813) 933-5953,Care A Lot Homes LLC,6,For-Profit
11969254,13070,Assisted Living Facility,ESPERANZA'S ALF INC,14336 SW 172 ST,MIAMI,FL,33177,Miami-Dade,(786) 429-1627,ESPERANZA'S ALF  INC,6,For-Profit
11968323,12223,Assisted Living Facility,ESTATE AT HYDE PARK  (THE),2301 W PALM DR,TAMPA,FL,33629,Hillsborough,(813) 251-6333,ARHC HBTPAFLO1 TRS  LLC,95,For-Profit
11967405,11452,Assisted Living Facility,ESTEVEZ HOME CARE CORP,3900 SW 122ND AVE,MIAMI,FL,33175,Miami-Dade,(305) 381-5233,ESTEVEZ HOME CARE CORP,6,For-Profit
11965422,9826,Assisted Living Facility,ESTHER HOME CARE I,9341 SW 32ND ST,MIAMI,FL,33165-4102,Miami-Dade,(786) 542-9954,ESTHER HOME CARE INC.,6,For-Profit
11932534,8151,Assisted Living Facility,ESTHER HOME CARE INC,13908 S.W. 26 TERRACE,MIAMI,FL,33175,Miami-Dade,(786) 543-3467,ESTHER HOME CARE INC.,6,For-Profit
11964357,8993,Assisted Living Facility,EUSTIS SENIOR CARE,228 NORTH CENTER STREET,EUSTIS,FL,32726,Lake,(352) 589-8944,AMBRAY AND LABAYNE CORP,30,For-Profit
11966989,11087,Assisted Living Facility,EVELYN'S PARADISE #1 LLC,11470 SW 80 TERRACE,MIAMI,FL,33173,Miami-Dade,(305) 412-4650,EVELYN'S PARADISE #1 LLC,6,For-Profit
11966549,10750,Assisted Living Facility,EVELYN'S PARADISE LLC,120 APACHE STREET,MIAMI SPRINGS,FL,33166,Miami-Dade,(786) 470-4342,EVELYN'S PARADISE LLC,6,For-Profit
11968633,12519,Assisted Living Facility,EVELYN'S PLACE  INC.,4901 JEFFERSON STREET,HOLLYWOOD,FL,33021,Broward,(954) 894-0399,EVELYN'S PLACE  INC.,6,For-Profit
11963853,8760,Assisted Living Facility,EVERGREEN MANOR RETIREMENT HOME,3297 STATE ROAD 580,SAFETY HARBOR,FL,34695-4929,Pinellas,(727) 724-3776,K And D Care Communities,36,For-Profit
11969240,13045,Assisted Living Facility,EVERLASTING FAMILY HOME CARE SERVICES II LLC,197 PONCE DE LEON ST,ROYAL PALM BEACH,FL,33411,Palm Beach,(561) 907-6956,EVERLASTING FAMILY HOME CARE SERVICES II LLC,6,For-Profit
11969063,12890,Assisted Living Facility,EVERLASTING FAMILY HOME CARE SERVICES LLC,2722 OKLAHOMA ST,WEST PALM BEACH,FL,33406,Palm Beach,(561) 907-6956,EVERLASTING FAMILY HOME CARE SERVICES LLC,6,For-Profit
11969022,12850,Assisted Living Facility,EXCELLENCE ASSISTED LIVING FACILITY,2250 S SEMORAN BLVD,ORLANDO,FL,32822,Orange,(407) 930-9291,EXCELLENCE ASSISTED LIVING FACILITY  LLC,185,For-Profit
11967575,11639,Assisted Living Facility,EXCELLENT GRANDPARENT PLACE  INC,13342 SW 6 STREET,MIAMI,FL,33184,Miami-Dade,(305) 227-0129,EXCELLENT GRANDPARENT PLACE INC,6,For-Profit
11969505,13308,Assisted Living Facility,EXCELSIOR OMEGA # 2,2731 23RD ST,SARASOTA,FL,34234,Sarasota,(941) 371-4091,EXCELSIOR OMEGA INC,6,For-Profit
11967402,11449,Assisted Living Facility,EXCELSIOR OMEGA INC,15 DADE AVENUE,SARASOTA,FL,34232,Sarasota,(941) 371-4091,EXCELSIOR OMEGA INC,12,For-Profit
11965384,9772,Assisted Living Facility,EXCLUSIVE HOME,183 W 18TH ST,HIALEAH,FL,33010-2636,Miami-Dade,(305) 882-0114,SWEET HOME ALF  INC.,6,For-Profit
11967201,11251,Assisted Living Facility,EXQUISITE SENIOR CARE  INC.,2616 WASHINGTON STREET,HOLLYWOOD,FL,33020,Broward,(954) 274-6849,EXQUISITE SENIOR CARE  INC.,6,For-Profit
11969193,13011,Assisted Living Facility,EXTENDED CARE LLC,5423 HARRISON STREET,HOLLYWOOD,FL,33021,Broward,(954) 967-8428,EXTENDED CARE LLC,6,For-Profit
11968565,12433,Assisted Living Facility,EXTENDING LOVABLE LIVING ASSISTANCE  LLC,14514 STORYS FORD RD,ORLANDO,FL,32832,Orange,(321) 245-7096,EXTENDING LOVABLE LIVING ASSISTANCE  LLC,5,For-Profit
11966571,12967,Assisted Living Facility,EYEA PALACE CORP,3654 SW 156TH COURT,MIAMI,FL,33185,Miami-Dade,(305) 896-2838,EYEA PALACE CORP,6,For-Profit
11969328,13125,Assisted Living Facility,FABULOUS RESORT ALF  LLC,1762 SE CARVALHO ST,PORT SAINT LUCIE,FL,34983,St. Lucie,(772) 577-3861,FABULOUS RESORT ALF  LLC,6,For-Profit
11966901,11072,Assisted Living Facility,FAIRGREEN ASSISTED LIVING FACILITY INC,1150 WAYNE AVE,NEW SMYRNA,FL,32168,Volusia,(386) 428-3018,FAIRGREEN ASSISTED LIVING INC,40,For-Profit
11942831,7276,Assisted Living Facility,FAIRWAY CHALET,905 VIRGINIA AVENUE,TARPON SPRINGS,FL,34689,Pinellas,(727) 934-4970,FAIRWAY CHALET  INC.,14,For-Profit
11968557,12447,Assisted Living Facility,FAITH HOME CARE ALF INC,114 EUCLID AVE,SEFFNER,FL,33584,Hillsborough,(813) 689-1922,FAITH HOME CARE ALF INC,5,For-Profit
11966891,10995,Assisted Living Facility,FAITH HOUSE ASSISTED LIVING FACILITY,335 FOSTER COVE,CHULUOTA,FL,32766,Seminole,(407) 366-9961,FAITH HOUSE ASSISTED LIVING FACILITY  LLC,13,For-Profit
11969273,13096,Assisted Living Facility,FAITHFUL FRIENDS INC,1902 49TH AVE E,BRADENTON,FL,34203,Manatee,(941) 237-8174,FAITHFUL FRIENDS INC,10,For-Profit
11969820,13569,Assisted Living Facility,FAITHFUL FRIENDS LOVING CARE ASSISTED LIVING CORPORATION,323 49TH ST NW,BRADENTON,FL,34209,Manatee,(941) 237-8174,FAITHFUL FRIENDS LOVING CARE ASSISTED LIVING CORPORATION,6,For-Profit
11967453,11521,Assisted Living Facility,FAMILY CONNECT LIFE INC,7969 PINEHURST DR,SPRING HILL,FL,34606-4330,Hernando,(352) 686-8106,FAMILY CONNECT LIFE INC,10,For-Profit
11964934,9381,Assisted Living Facility,FAMILY EXTENDED CARE OF SARASOTA (DBA) CABOT RESERVE ON THE GREE,4450 8TH STREET,SARASOTA,FL,34232,Sarasota,(941) 377-3231,FAMILY EXTENDED CARE OF SARASOTA  INC,65,Not-For-Profit
11965376,9756,Assisted Living Facility,FAMILY EXTENDED CARE OF SEBRING INC,5005 SUN N LAKE BLVD,SEBRING,FL,33872-2175,Highlands,(863) 386-1060,FAMILY EXTENDED CARE OF SEBRING INC,85,Not-For-Profit
11965378,9757,Assisted Living Facility,FAMILY EXTENDED CARE OF SPRING HILL NW INC,11291 COUNTY LINE RD,SPRING HILL,FL,34609-5616,Hernando,(352) 799-1422,FAMILY EXTENDED CARE OF SPRING HILL NW INC,58,For-Profit
11967287,11365,Assisted Living Facility,FAMILY FIRST ALF INC,15600 SW 143RD AVENUE,MIAMI,FL,33177,Miami-Dade,(305) 252-1805,FAMILY FIRST ALF INC,6,For-Profit
11969792,13542,Assisted Living Facility,FAMILY GROUP HOME LLC,11010 SW 38TH ST,MIAMI,FL,33165,Miami-Dade,(305) 603-9603,Family Group Home LLC,6,For-Profit
11969672,13466,Assisted Living Facility,FAMILY HOME ALF,1708 LOQUAT DRIVE,MELBOURNE,FL,32901,Brevard,(954) 662-1566,FAMILY HOME ALF LLC,6,For-Profit
11969514,13340,Assisted Living Facility,FAMILY HOME CARE INC,2328 LEWIS RD,WEST PALM BEACH,FL,33413,Palm Beach,(561) 667-2121,FAMILY HOME CARE INC,6,For-Profit
11911276,7392,Assisted Living Facility,FAMILY OF FRIENDS  INC (THE),2340 CELERY AVENUE,SANFORD,FL,32771,Seminole,(407) 732-4981,THE FAMILY OF FRIENDS  INC.,14,Not-For-Profit
11922298,8038,Assisted Living Facility,FAMILY TRADITIONS LLC,352 LAKE ROAD,VENICE,FL,34293,Sarasota,(941) 497-0134,FAMILY TRADITIONS LLC,6,For-Profit
11969304,13167,Assisted Living Facility,FAMILY WELFARE LLC,26901 SW 143 CT,HOMESTEAD,FL,33032,Miami-Dade,(786) 333-3530,Family Welfare LLC,6,For-Profit
11911149,7201,Assisted Living Facility,FANNIE E. TAYLOR HOME FOR THE AGED-TAYLOR MANOR  INC.,6605 CHESTER AVENUE,JACKSONVILLE,FL,32217,Duval,(904) 636-0142,FANNIE E. TAYLOR HOME FOR THE AGED-MANOR  INC.,103,Not-For-Profit
11964616,9278,Assisted Living Facility,FARAH MICHELE A.L.F.  INC,431 WEST 31 PLACE,HIALEAH,FL,33012,Miami-Dade,(305) 846-9840,FARAH MICHELLE ALF INC,6,For-Profit
11967611,11613,Assisted Living Facility,FARRINGTON HOUSE ASSISTED LIVING FACILITY,1970 FARRINGTON DRIVE,MERRITT ISLAND,FL,32952,Brevard,(321) 208-7955,CADIZ SENIOR CARE  LLC,6,For-Profit
11964226,8876,Assisted Living Facility,FEBA LIVING CARE INC,6120 N.W. 2ND ST,MIAMI,FL,33126,Miami-Dade,(305) 269-9279,FEBA LIVING CARE INC,6,For-Profit
11932571,4653,Assisted Living Facility,FEEL AT HOME INC,129 W 131 AVE,TAMPA,FL,33612-3443,Hillsborough,(813) 933-9845,FEEL AT HOME  INC.,16,For-Profit
11969363,13187,Assisted Living Facility,FEELS LIKE HOME IN TAMPA ALF INC,6018 MEMORIAL HWY,TAMPA,FL,33615,Hillsborough,(813) 252-8418,FEELS LIKE HOME IN TAMPA ALF  INC,6,For-Profit
11969731,13503,Assisted Living Facility,FELIX & OSCAR LLC,3271-3275 NW 106 ST,MIAMI,FL,33147,Miami-Dade,(786) 626-2625,Felix & Oscar LLC,6,For-Profit
11969610,13430,Assisted Living Facility,FELLOWSHIP HAVEN LLC,10968 NW 9TH MANOR,CORAL SPRINGS,FL,33071,Broward,(678) 230-2118,Fellowship Haven LLC,6,For-Profit
11942783,5105,Assisted Living Facility,FELLOWSHIP HOME AT THE FAIRWAY,5959 SUN N LAKE BLVD,SEBRING,FL,33872,Highlands,(863) 385-5454,Fellowship Home At The Fairway LLC,175,For-Profit
11910630,4781,Assisted Living Facility,FINNISH-AMERICAN VILLAGE,1800 SOUTH DR,LAKE WORTH,FL,33461-6133,Palm Beach,(561) 588-4333,FINNISH AMERICAN REST HOME  INC.,120,Not-For-Profit
11968622,12501,Assisted Living Facility,FIRST CHOICE ALF,2221 JAMAICA DRIVE,MIRAMAR,FL,33023,Broward,(954) 600-6285,SAVI HOME CARE  INC.,5,For-Profit
11968904,12744,Assisted Living Facility,FIRST CHOICE COMFORT CARE INCORPORATED,6200-6210 CLEVELAND ST,HOLLYWOOD,FL,33024,Broward,(954) 983-5174,FIRST CHIOICE COMFORT CARE  INCORPORATED,15,For-Profit
11969542,13346,Assisted Living Facility,FIRST STEP CARE ASSISTED LIVING,590 MARION AVE,ALTAMONTE SPRINGS,FL,32714,Seminole,,First Step Care  LLC,6,For-Profit
11911086,5705,Assisted Living Facility,FIVE OAKS REST HOME,611 OLD WELAKA ROAD,WELAKA,FL,32193,Putnam,(386) 467-2004,SHIRLEY ADAMS,27,For-Profit
11969261,13115,Assisted Living Facility,FIVE STAR ASSISTED LIVING FACILITY INC,5384 NW 4 ST,MIAMI,FL,33126,Miami-Dade,(786) 953-4975,FIVE STAR ASSISTED LIVING FACILITY  INC,14,For-Profit
11911162,7532,Assisted Living Facility,FIVE STAR PREMIER RESIDENCES OF BOCA RATON,22601 CAMINO DEL MAR,BOCA RATON,FL,33433-6516,Palm Beach,(561) 750-7100,SNH BRFL TENANT  LLC,75,For-Profit
11953616,5622,Assisted Living Facility,FIVE STAR PREMIER RESIDENCES OF HOLLYWOOD,2480 NORTH PARK ROAD,HOLLYWOOD,FL,33021,Broward,(954) 989-8008,SNH SE TENANT TRS  INC.,200,For-Profit
11910689,7340,Assisted Living Facility,FIVE STAR PREMIER RESIDENCES OF PLANTATION,8600 WEST SUNRISE BLVD,PLANTATION,FL,33322,Broward,(954) 476-9500,SNH PLFL TENANT  LLC,70,For-Profit
11932585,7702,Assisted Living Facility,FIVE STAR PREMIER RESIDENCES OF POMPANO BEACH,1371 SOUTH OCEAN BLVD,POMPANO BEACH,FL,33062,Broward,(954) 943-1155,SNH SE TENANT TRS  INC.,68,For-Profit
11969561,13335,Assisted Living Facility,FIVE STARS ALF INC,16151 SW 151 TERR,MIAMI,FL,33196,Miami-Dade,(786) 715-2351,Five Stars ALF INC,6,For-Profit
11969636,13434,Assisted Living Facility,FL MEMORY LANE LLC,108 LOUISIANA DR,PENSACOLA,FL,32505,Escambia,(423) 304-5512,FL Memory Lane LLC,10,For-Profit
11968487,12370,Assisted Living Facility,FLAMINGO ALF,4788 NW 1ST ST,PLANTATION,FL,33317-3136,Broward,(954) 999-0567,WELCOME HOME CARE INC,6,For-Profit
11967457,11525,Assisted Living Facility,FLAMINGO CARE LLC,1270 NE 174 STREET,NORTH MIAMI BEACH,FL,33162,Miami-Dade,(954) 394-4495,FLAMINGO CARE LLC,6,For-Profit
11911119,7607,Assisted Living Facility,FLEET LANDING,ONE FLEET LANDING BOULEVARD,ATLANTIC BEACH,FL,32233,Duval,(904) 246-9900,NAVAL CONTINUING CARE RETIREMENT FOUNDATION INC,150,Not-For-Profit
11968267,12179,Assisted Living Facility,FLORENTINA'S HOUSE ALF CORP,4203 W OHIO AVE,TAMPA,FL,33614-7825,Hillsborough,(813) 252-6241,FLORENTINAS HOUSE ALF CORP,6,For-Profit
11969719,13459,Assisted Living Facility,FLORIDA ACCESS CARE INC,4803 4805 VILABELLA DR,SEBRING,FL,33872,Highlands,(863) 259-4322,FLORIDA ACCES CARE INC,16,For-Profit
11910631,3206,Assisted Living Facility,FLORIDA BAPTIST RETIREMENT CENTER,1006 33RD STREET,VERO BEACH,FL,32960,Indian River,(772) 567-5248,FLORIDA BAPTIST RETIREMENT CENTER  INC.,17,Not-For-Profit
11967641,11682,Assisted Living Facility,FLORIDA HOME CARE ALF INC,2931 NW 106TH STREET,MIAMI,FL,33147,Miami-Dade,(305) 693-1449,FLORIDA HOME CARE ALF INC,6,For-Profit
11911251,4790,Assisted Living Facility,FLORIDA PRESBYTERIAN HOMES INC,16 LAKE HUNTER DR,LAKELAND,FL,33803,Polk,(863) 688-5521,FLORIDA PRESBYTERIAN HOMES INC,136,Not-For-Profit
11932662,8229,Assisted Living Facility,FLORIDA SHORES ASSISTED LIVING  INC.,1229 MANGO TREE DRIVE,EDGEWATER,FL,32132,Volusia,(386) 428-5370,FLORIDA SHORES ASSISTED LIVING  INC,14,For-Profit
11911311,7324,Assisted Living Facility,FLORIDA SHORES OF MELBOURNE 1 ALF,2155 KEYSTONE AVENUE,MELBOURNE,FL,32904,Brevard,(321) 726-8070,FLORIDA SHORES OF MELOURNE ASSISTED LIVING  INC.,16,For-Profit
11967853,11825,Assisted Living Facility,FLORRY HOUSE (THE),5111 SMITH RYALS RD,PLANT CITY,FL,33567-3749,Hillsborough,(813) 650-8242,FLORRY CREATIVE CARE CORP,6,For-Profit
11932592,7179,Assisted Living Facility,FOREST OAKS OF SPRING HILL,8055 FOREST OAKS BLVD,SPRING HILL,FL,34606-2406,Hernando,(352) 683-3323,GAHC4 FOREST OAKS FL TRS SUB LLC,135,For-Profit
11966775,10921,Assisted Living Facility,FOREST SPRING GARDEN  LLC,7512 SW 5TH STREET,NORTH LAUDERDALE,FL,33068,Broward,(954) 724-2038,FOREST SPRING GARDEN LLC,6,For-Profit
11965135,9549,Assisted Living Facility,FORSYTH HOUSE,5887 BERRYHILL RD,MILTON,FL,32570,Santa Rosa,(850) 626-9901,VERITAS INCARE LLC,44,For-Profit
11966829,10960,Assisted Living Facility,FORT CAROLINE GARDENS  LLC,9150 FORT CAROLINE RD,JACKSONVILLE,FL,32225-4335,Duval,(904) 743-3315,FORT CAROLINE GARDENS  LLC,78,For-Profit
11932380,7797,Assisted Living Facility,FOUNDATIONAL HEALTH ALF,10591 BAY PINES BLVD,ST PETERSBURG,FL,33708-3101,Pinellas,(727) 391-5967,FOUNDATIONAL HEALTH ASSISTED LIVING FACILITY  INC.,6,For-Profit
11953584,8624,Assisted Living Facility,FOUNTAINS OF MELBOURNE,4451 STACK BLVD,MELBOURNE,FL,32901,Brevard,(321) 984-1494,KRC MELBOURNE  LIMITED PARTNERSHIP,120,For-Profit
11911439,7109,Assisted Living Facility,FOUNTAINS RESIDENCE AT MILL COVE,9960 ATRIUM WAY,JACKSONVILLE,FL,32225,Duval,(904) 724-4726,ATRIUM ALF OPERATING LLC,115,For-Profit
11953207,7827,Assisted Living Facility,FOUNTAINVIEW,145 EXECUTIVE CENTER DRIVE,WEST PALM BEACH,FL,33401,Palm Beach,(561) 697-5500,SNH FLA TENANT LLC,102,For-Profit
11967647,11660,Assisted Living Facility,FOUR SEASONS ELDER CARE ALF  INC.,6625 MIAMI LAKEWAY S,MIAMI LAKES,FL,33014-2748,Miami-Dade,(305) 200-3937,FOUR SEASONS ELDER CARE ALF  INC.,6,For-Profit
11969405,13194,Assisted Living Facility,FOXTAIL LODGE,4104 FOXTAIL CT,KISSIMMEE,FL,34746,Osceola,(407) 483-7601,DJMP MANAGEMENT FLORIDA LLC,12,For-Profit
11965118,9589,Assisted Living Facility,FRAN'S ELDERLY CARE,1309 ALCORN RD,PORT ORANGE,FL,32129,Volusia,(407) 906-9929,LSL House LLC,6,For-Profit
11969682,13451,Assisted Living Facility,FREEDOM OAKS ASSISTED LIVING INC,579 JOHNSON LAKE RD,DE LEON SPRINGS,FL,32130,Volusia,(386) 767-5556,Freedom Oaks Assisted Living  Inc.,10,For-Profit
11965147,9634,Assisted Living Facility,FREEDOM PLAZA ASSISTED LIVING AND MEMORY CARE,3910 GALEN CT,SUN CITY CTR,FL,33573-6817,Hillsborough,(813) 633-1992,CCRC OPCO - SUN CITY CENTER  LLC,88,For-Profit
11964685,9207,Assisted Living Facility,FREEDOM POINTE ASSISTED LIVING,1475 EL CAMINO REAL,LADY LAKE,FL,32159,Sumter,3527501355,CCRC - FREEDOM POINTE AT THE VILLAGES  LLC,58,For-Profit
11968774,12644,Assisted Living Facility,FREEDOM POINTE PLACE ASSISTED LIVING AND MEMORY CARE,1700 EL CAMINO REAL,THE VILLAGES,FL,32159,Sumter,3527501355,CCRC - FREEDOM POINTE AT THE VILLAGES  LLC,135,For-Profit
11964655,9198,Assisted Living Facility,FREMONT MANOR,909 FREMONT AVENUE,WINTER PARK,FL,32789,Orange,(321) 316-4881,VINRENE  INC.,12,For-Profit
11953211,8446,Assisted Living Facility,FRENCH BLOSSOMS LLC,1782 COCONUT DRIVE,VENICE,FL,34293,Sarasota,(941) 661-2650,FRENCH BLOSSOMS LLC,8,For-Profit
11965844,10323,Assisted Living Facility,FRESH HORIZONS,4836 35TH AVENUE,VERO BEACH,FL,32967,Indian River,(772) 564-7271,ROCK SERVICES INC,8,Not-For-Profit
11964511,9047,Assisted Living Facility,FRESHWATER AT HUDSON,14108 OLD DIXIE HWY,HUDSON,FL,34667-1362,Pasco,(727) 869-6094,CMO FACILITIES II INC,17,For-Profit
11968142,12101,Assisted Living Facility,FRIENDLY HOUSE OF TAMPA BAY INC THE,2602 W COMANCHE AVE,TAMPA,FL,33614-6175,Hillsborough,(813) 915-5016,THE FRIENDLY HOUSE OF TAMPA BAY  INC,8,For-Profit
11965243,9640,Assisted Living Facility,FRIENDS AT HOME ASSISTED LIVING  INC,3680 CANAVERAL GROVES BLVD.,COCOA,FL,32926,Brevard,(321) 449-9639,FRIENDS @ HOME ASSISTED LIVING INC,15,For-Profit
11965540,9876,Assisted Living Facility,FRUITVILLE HOLDINGS OPPIDAN INC,4024 FRUITVILLE ROAD,SARASOTA,FL,34232,Sarasota,(941) 371-9158,FRUITVILLE HOLDINGS-OPPIDAN  INC.,6,For-Profit
11967062,11157,Assisted Living Facility,FULLNESS OF LOVE ASSISTED LIVING FACILITY  INC.,3405 KNOLLS ROAD,MIRAMAR,FL,33025,Broward,(954) 435-0354,FULLNESS OF LOVE ALF  INC,6,For-Profit
11969200,13085,Assisted Living Facility,FUTURE HOME CARE OF AMERICA LLC,24709 RODAS DR,BONITA SPRINGS,FL,34135,Lee,(239) 240-0907,Future Home Care of America  LLC,6,For-Profit
11969466,13273,Assisted Living Facility,G AND E ASSISTED LIVING LLC,960 MAEMIR WY,ROCKLEDGE,FL,32955,Brevard,(321) 271-1142,G AND E ASSISTED LIVING LLC,6,For-Profit
11964119,8941,Assisted Living Facility,GABLES ESTATES ALS INC,1881 SW 37TH AVE,MIAMI,FL,33145-1745,Miami-Dade,(305) 774-5801,GABLES ESTATES ALS INC,6,For-Profit
11943019,7926,Assisted Living Facility,GABLES MANOR INDEPENDENT INC.,1535 VENETIA AVENUE,CORAL GABLES,FL,33134,Miami-Dade,(786) 409-3179,GABLES MANOR INDEPENDENT  INC,6,For-Profit
11911921,7810,Assisted Living Facility,GABRIELS' HOME ALF  INC.,11232 SW 7TH ST,MIAMI,FL,33174-1151,Miami-Dade,(305) 229-9860,GABRIELS' HOME ALF INC,12,For-Profit
11965022,9556,Assisted Living Facility,GAIL'S ALF,811 E OSBORNE AVE,TAMPA,FL,33603-4019,Hillsborough,(813) 239-3322,GAIL'S ALF  INC.,10,For-Profit
11967758,11778,Assisted Living Facility,GALLOWAY ADULT CARE INC,10740 SW 87TH AVE,MIAMI,FL,33176-3705,Miami-Dade,(786) 360-2636,GALLOWAY ADULT CARE  INC.,6,For-Profit
11967039,11134,Assisted Living Facility,GARDEN HILLS RETIREMENT CENTER  INC,10337 SW 159TH CT,MIAMI,FL,33196-6143,Miami-Dade,(305) 382-8712,GARDEN HILLS RETIREMENT CENTER  INC,6,For-Profit
11967462,11547,Assisted Living Facility,GARDEN MANOR INC.,1562 GARDEN AVENUE,HOLLY HILL,FL,32117,Volusia,(386) 677-0402,GARDEN MANOR INC,28,For-Profit
11968262,12249,Assisted Living Facility,GARDEN OASIS ALF,515 HICKORY LAKE DR,BRANDON,FL,33511,Hillsborough,(813) 315-8233,GARDEN OASIS ALF  LLC,6,For-Profit
11969613,13410,Assisted Living Facility,GARDEN OASIS SENIOR LIVING,415 DAVID ST,WINTER SPRINGS,FL,32708,Seminole,(407) 529-4280,A & S FAMILY LLC,6,For-Profit
11968125,12067,Assisted Living Facility,GARDEN OF ROSES,3629 SE 2ND ST,BOYNTON BEACH,FL,33435,Palm Beach,(954) 682-1783,GARDEN OF ROSES ASSISTED LIVING LLC,6,For-Profit
11967297,11388,Assisted Living Facility,GARDEN VALLEY RETIREMENT HOME LLC,18140 NW 90 AVENUE,MIAMI,FL,33018,Miami-Dade,(786) 703-2131,GARDEN VALLEY RETIREMENT HOME LLC,6,For-Profit
11910568,5223,Assisted Living Facility,GARDEN VIEW ALF,526 N MARY ELLA AVE,PANAMA CITY,FL,32404-2323,Bay,(850) 871-1611,HSW OF PANAMA CITY LLC,40,For-Profit
11963756,8231,Assisted Living Facility,GARDEN VILLAS,912 N OLIVE AVENUE,WEST PALM BEACH,FL,33401,Palm Beach,(561) 820-9946,ASSISTED MEDCARE  INC.,16,For-Profit
11911011,5738,Assisted Living Facility,GARDEN WALK ASSISTED LIVING CORP,1760 EAST 1 AVENUE,HIALEAH,FL,33010,Miami-Dade,(305) 885-7733,GARDEN WALK ASSISTED LIVING CORP,34,For-Profit
11967596,11585,Assisted Living Facility,GARDENS AT LAKEVIEW (THE),30 W GARDEN AVENUE,WINTER GARDEN,FL,34787,Orange,(407) 947-5687,GARDENS AT LAKEVIEW LLC (THE),6,For-Profit
11968455,12341,Assisted Living Facility,GARDENS AT MONTVERDE LLC  THE,15425 CR 455,MONTVERDE,FL,34756,Lake,(407) 947-5687,GARDENS AT MONTVERDE LLC THE,10,For-Profit
11922369,5368,Assisted Living Facility,GARDENS AT TAVARES LLC (THE),900 EAST ALFRED ST,TAVARES,FL,32778-3402,Lake,(407) 947-5687,THE GARDENS AT TAVARES  LLC,36,For-Profit
11967678,11716,Assisted Living Facility,GARDENS HOME ALF LLC,18201 NW 57 AVENUE,MIAMI,FL,33055,Miami-Dade,(305) 974-2250,Gardens Home ALF LLC,6,For-Profit
11966640,10843,Assisted Living Facility,GARDENS OF NORTH PORT (THE),4900 S SUMTER BLVD,NORTH PORT,FL,34287-2917,Sarasota,(941) 423-0658,NORTH PORT RETIREMENT CENTER  INC.,50,For-Profit
11968757,12599,Assisted Living Facility,GARDENS OF TIME II CORP,2914 W SLIGH AVE,TAMPA,FL,33614,Hillsborough,(813) 505-5564,GARDENS OF TIME II CORP,5,For-Profit
11968362,12263,Assisted Living Facility,GARDENS OF TIME LLC,4603 N SAINT VINCENT ST,TAMPA,FL,33614,Hillsborough,(813) 505-5564,GARDENS OF TIME LLC,8,For-Profit
11968551,12423,Assisted Living Facility,GARDENS OF VENICE RETIREMENT RESIDENCE,2901 JACARANDA BLVD,VENICE,FL,34293,Sarasota,(941) 497-0650,NORTH PORT RETIREMENT CENTER  INC.,50,For-Profit
11922281,6061,Assisted Living Facility,GARDENS OF WESTBROOKE,6701 DAIRY ROAD,ZEPHYRHILLS,FL,33542,Pasco,(813) 782-4417,GARDENS OF WESTBROOKE LLC,135,For-Profit
11966204,10427,Assisted Living Facility,LOVE AND AFFECTIONATE ALF  INC.,311 SW 77TH TERRACE,NORTH LAUDERDALE,FL,33068,Broward,(954) 718-7556,LOVE AND AFFECTIONATE ALF  INC.,6,For-Profit
11910993,7351,Assisted Living Facility,LOVE AND CARE ALF INC,6701 SW 27TH ST,MIAMI,FL,33155-2913,Miami-Dade,(305) 603-7300,LOVE AND CARE ALF  INC.,6,For-Profit
11968136,12071,Assisted Living Facility,LOVE OF HOPE ALF INC,2911 NW 174TH ST,MIAMI GARDENS,FL,33056-4036,Miami-Dade,(786) 662-9587,LOVE OF HOPE ALF  INC.,6,For-Profit
11967341,11407,Assisted Living Facility,LOVE PARADISE  INC,9984 SW 19TH ST,MIAMI,FL,33165-7541,Miami-Dade,(305) 552-8310,LOVE PARADISE  INC,6,For-Profit
11969570,13370,Assisted Living Facility,LOVE VILLAGE USA INC,3241 SW 117 CT,MIAMI,FL,33175,Miami-Dade,(305) 710-4577,LOVE VILLAGE USA  INC.,6,For-Profit
11969580,13467,Assisted Living Facility,LOVELY HOME ALF,1246 HARLINGEN RD SW,PALM BAY,FL,32908,Brevard,(321) 543-4372,Lovely Home ALF LLC,5,For-Profit
11969220,13048,Assisted Living Facility,LOVEY'S ALF LLC,112 5TH ST,HOLLY HILL,FL,32117,Volusia,(386) 265-2912,Loveys AFL LLC,6,For-Profit
11968482,12405,Assisted Living Facility,LOVING ANGELS ASSISTED LIVING  LLC,9 RAMBLE WAY,PALM COAST,FL,32164,Flagler,(386) 313-1586,Loving Angels Assisted Living LLC,6,For-Profit
11968836,12685,Assisted Living Facility,LOVING CARE ALF INC,11008 AIRVIEW DR,TAMPA,FL,33625,Hillsborough,(813) 264-1850,LOVING CARE ALF INC,6,For-Profit
11922240,6146,Assisted Living Facility,LOVING CARE ASSISTED LIVING LLC,870 7TH AVE NE,LARGO,FL,33770,Pinellas,(727) 581-4506,LOVING CARE ASSISTED LIVING  LLC,8,For-Profit
11963776,8926,Assisted Living Facility,LOVING CARE CENTER INC II,10301 SW 51 ST,MIAMI,FL,33165,Miami-Dade,(305) 274-1980,LOVING CARE CENTER  INC,6,For-Profit
11943150,8444,Assisted Living Facility,LOVING CARE CENTER  THE,9210 SW 56TH ST,MIAMI,FL,33165-6527,Miami-Dade,(305) 274-1980,LOVING CARE CENTER  INC,6,For-Profit
11932431,8149,Assisted Living Facility,LOVING CARE LIVING FACILITY,76 BRUEN STREET,SAINT AUGUSTINE,FL,32095,St. Johns,(904) 824-6616,LOVING CARE LIVING FACILITY  INC,8,For-Profit
11969369,13156,Assisted Living Facility,LOVING CARE OF THE TREASURE COAST II LLC,1816 SW BRISBANE STREET,PORT SAINT LUCIE,FL,34984,St. Lucie,(772) 353-5263,LOVING CARE OF THE TREASURE COAST II LLC,6,For-Profit
11968833,12683,Assisted Living Facility,LOVING CARE OF THE TREASURE COAST  LLC,2102 SW LARCHMONT LANE,PORT SAINT LUCIE,FL,34984,St. Lucie,(772) 240-9850,LOVING CARE OF THE TREASURE COAST  LLC,6,For-Profit
