Facility ID,License Number,State Facility Type 1 Literal,Facility Name,Address,City,State,Zip Code,County,Phone Number,Licensee,Capacity,Ownership Type
11969640,13393,Assisted Living Facility,GLORIA ASSISTED LIVING FACILITY LLC,5034 KATHY LN,WEST PALM BEACH,FL,33415,Palm Beach,(561) 693-7259,GLORIA ASSISTED LIVING FACILITY LLC,5,For-Profit
11966500,10702,Assisted Living Facility,GLORY ASSISTED LIVING FACILITY,7221 UDINE AVENUE,ORLANDO,FL,32819,Orange,(407) 345-4824,GLORY ASSISTED LIVING INC,6,For-Profit
11969203,13049,Assisted Living Facility,GOCIO HOME,3781 GOCIO RD,SARASOTA,FL,34235,Sarasota,(941) 371-4091,EXCELSIOR OMEGA INC,5,For-Profit
11968607,12482,Assisted Living Facility,GOD ANSWERS PRAYERS- EMMANUEL  INC,13470 SE 101 TER,BELLEVIEW,FL,34420,Marion,(352) 288-2508,GOD ANSWERS PRAYERS-EMMANUEL INC,6,Not-For-Profit
11969201,13087,Assisted Living Facility,GOLD CHOICE DELTONA,2310 N NORMANDY BLVD,DELTONA,FL,32725,Volusia,3862593860,DELTONA ALF MANAGEMENT  LLC,96,For-Profit
11967442,11475,Assisted Living Facility,GOLD CHOICE ORMOND BEACH,1410 HAND AVE,ORMOND BEACH,FL,32174,Volusia,(386) 236-1829,ORMOND ALF MANAGEMENT  LLC,75,For-Profit
11969803,13591,Assisted Living Facility,GOLD CHOICE PALM COAST,3830 OLD KINGS RD,PALM COAST,FL,32137,Flagler,(386) 307-5445,PALM COAST ALF MANAGEMENT LLC,100,For-Profit
11967463,11493,Assisted Living Facility,GOLD COAST LOVING CARE  INC.,5517 HAYES STREET,HOLLYWOOD,FL,33021-4632,Broward,(954) 534-9401,GOLD COAST LOVING CARE  INC.,6,For-Profit
11968541,12443,Assisted Living Facility,GOLDEN AGE ALF OF TAMPA BAY INC,3328 W SPRUCE ST,TAMPA,FL,33607-4225,Hillsborough,(813) 877-6581,GOLDEN AGE ALF OF TAMPA BAY INC,8,For-Profit
11967327,11384,Assisted Living Facility,GOLDEN AGE ALF V  LLC,7861 NW 175TH ST,HIALEAH,FL,33015,Miami-Dade,(305) 400-8976,GOLDEN AGE ASSISTED LIVING FACILITY V  LLC,6,For-Profit
11966994,11111,Assisted Living Facility,GOLDEN AGE ALF VI LLC,9700 NW 29TH AVE,MIAMI,FL,33147-2342,Miami-Dade,(786) 631-3841,Golden Age ALF VI LLC,6,For-Profit
11966030,10311,Assisted Living Facility,GOLDEN AGE ASSISTED LIVING FACILITY III  LLC,2793 WEST 72 STREET,HIALEAH,FL,33016,Miami-Dade,(305) 362-5264,GOLDEN AGE ASSISTED LIVING FACILITY III LLC,6,For-Profit
11953434,8126,Assisted Living Facility,GOLDEN AGE ASSISTED LIVING FACILITY IV LLC,7450 W 14TH CT,HIALEAH,FL,33014-3414,Miami-Dade,(786) 360-3661,GOLDEN AGE ASSISTED LIVING FACILITY IV LLC,6,For-Profit
11968393,12292,Assisted Living Facility,GOLDEN AGE ASSISTED LIVING FACILITY  CORP,5970 NW 3RD STREET,MIAMI,FL,33126,Miami-Dade,(305) 456-9538,GOLDEN AGE ASSISTED LIVING FACILITY CORP,6,For-Profit
11968984,12838,Assisted Living Facility,GOLDEN AGE AT BRENTFORD COURT,516 BRENTFORD CT,KISSIMMEE,FL,34758,Osceola,(407) 201-2486,GOLDEN AGE SENIOR LIVING CARE LLC,6,For-Profit
11969743,13507,Assisted Living Facility,GOLDEN AGE FACILITY LLC,4120 KIRKLAND LN,LAKE WORTH,FL,33461,Palm Beach,(561) 619-2925,GOLDEN AGE FACILITY LLC,5,For-Profit
11967764,11817,Assisted Living Facility,GOLDEN AGE FAMILY HOME II  INC,15962 SW 81 STREET,MIAMI,FL,33193,Miami-Dade,(305) 385-5498,GOLDEN AGE FAMILY HOME II  INC.,6,For-Profit
11910732,1063,Assisted Living Facility,GOLDEN AGE MANOR ALF,1110 SW 40TH AVE,PLANTATION,FL,33317-4527,Broward,(954) 583-3321,GOLDEN AGE MANOR ALF,29,For-Profit
11968514,12378,Assisted Living Facility,GOLDEN AGE SENIOR LIVING CARE LLC,533 BRISTOL CR,KISSIMMEE,FL,34758,Osceola,4072015623,GOLDEN AGE SENIOR LIVING CARE LLC,6,For-Profit
11966622,10786,Assisted Living Facility,GOLDEN AGE SENIORS OF SUNRISE  INC.,9811 NW 31ST PLACE,SUNRISE,FL,33351,Broward,(954) 708-9264,GOLDEN AGE SENIORS OF SUNRISE  INC.,6,For-Profit
11969710,13460,Assisted Living Facility,GOLDEN BUTTERFLY CORP,6217 PALVIEW CT,TAMPA,FL,33625,Hillsborough,(813) 244-3298,GOLDEN BUTTERFLY CORP,6,For-Profit
11969044,12875,Assisted Living Facility,GOLDEN CARE FACILITY LLC,4909 ROYAL CT S,WEST PALM BEACH,FL,33415,Palm Beach,(561) 429-4860,GOLDEN CARE FACILITY LLC,5,For-Profit
11968986,12905,Assisted Living Facility,GOLDEN CARRIAGE RETIREMENT HOME 1 INC,926 MELLER WAY,ORLANDO,FL,32825,Orange,(954) 662-4081,Golden Carriage Retirement Home 1  Inc.,6,For-Profit
11965458,9837,Assisted Living Facility,GOLDEN COVE ALF,918 EGAN DRIVE,ORLANDO,FL,32822,Orange,(407) 281-1886,GOLDEN COVE ALF INC.,6,For-Profit
11966939,11065,Assisted Living Facility,GOLDEN GIRLS HOME  INC,15700 SW 102ND AVE,MIAMI,FL,33157-1655,Miami-Dade,(305) 333-0567,GOLDEN GIRLS HOME INC,6,For-Profit
11969783,13582,Assisted Living Facility,GOLDEN GROVE LLC,125 BENCHOR RD NW,PALM BAY,FL,32907,Brevard,(718) 791-4038,GOLDEN GROVE LLC,6,For-Profit
11969784,13584,Assisted Living Facility,GOLDEN GROVE LLC,558 RHEINE RD NW,PALM BAY,FL,32907,Brevard,(646) 279-8564,GOLDEN GROVE LLC,6,For-Profit
11968053,12021,Assisted Living Facility,GOLDEN HOUSE SENIOR LIVING #1,3991 CR 210 WEST,SAINT JOHNS,FL,32259,St. Johns,(904) 874-7165,GOLDEN HOUSE ASSISTED LIVING INC.,10,For-Profit
11966850,11015,Assisted Living Facility,GOLDEN LIFE ALF LLC,200 SE LINCOLN CIR N,ST PETERSBURG,FL,33703-1435,Pinellas,(727) 520-9314,GOLDEN LIFE ALF LLC,6,For-Profit
11969652,13428,Assisted Living Facility,GOLDEN MANOR ASSISTED LIVING FACILITY LLC,197 NW GWEN LAKE AVE,LAKE CITY,FL,32055,Columbia,(386) 697-9425,Golden Manor Assisted Living Facility LLC,5,For-Profit
11964009,8845,Assisted Living Facility,GOLDEN MEMORIES LLC,1162 WEST 30TH STREET,HIALEAH,FL,33012,Miami-Dade,(305) 819-8710,Golden Memories LLC,6,For-Profit
11965572,9930,Assisted Living Facility,GOLDEN PALMS-ASSISTED LIVING FACILITY  INC.,7280 NW 169 STREET,MIAMI,FL,33015,Miami-Dade,(305) 826-9261,GOLDEN PALMS- ASSISTED LIVING FACILITY  INC.,6,For-Profit
11965225,9626,Assisted Living Facility,GOLDEN POND COMMUNITIES,402 LAKEVIEW ROAD,WINTER GARDEN,FL,34787,Orange,(407) 654-7217,WINTER GARDEN OPCO  LLC.,108,For-Profit
11967251,11306,Assisted Living Facility,GOLDEN RANCH  INC.,5711 SW 196TH LANE,SOUTHWEST RANCHES,FL,33332,Broward,(954) 680-7019,GOLDEN RANCH  INC.,6,For-Profit
11969312,13127,Assisted Living Facility,GOLDEN RETREAT OF NAPLES INC,3670 58TH AVE NE,NAPLES,FL,34120,Collier,(239) 213-4257,GOLDEN RETREAT OF NAPLES INC,6,For-Profit
11910320,5846,Assisted Living Facility,GOLDEN RETREAT SHELTER CARE CENTER  INC.,4410 MONCRIEF RD. W.,JACKSONVILLE,FL,32209,Duval,(904) 764-2581,JONES SHELTER AND CARE  INC.,93,For-Profit
11968623,12488,Assisted Living Facility,GOLDEN RETREAT-2 ASSISTED LIVING FACILITY LLC,9465 LONGMEADOW CIR,BOYNTON BEACH,FL,33436,Palm Beach,(561) 234-7723,GOLDEN RETREAT 2 ASSISTED LIVING FACILITY LLC,5,For-Profit
11911209,5433,Assisted Living Facility,GOLDEN SANDS RETIREMENT HOME,809 NE 20TH AVE,FT LAUDERDALE,FL,33304-3035,Broward,(954) 524-6054,GOLDEN DIVERSIFIED SERVICES  INC.,14,For-Profit
11965300,9675,Assisted Living Facility,GOLDEN SUNSET,5019 MAGPIE DR,NEW PRT RCHY,FL,34652-4310,Pasco,(727) 846-1954,GOLDEN SUNSET ALF  INC,8,For-Profit
11967651,11654,Assisted Living Facility,GOLDEN SWAN ASSISTED LIVING  INC.,4755 NW 76TH ST,COCONUT CREEK,FL,33073-2706,Broward,(954) 867-8080,GOLDEN SWAN ASSISTED LIVING  INC.,6,For-Profit
11969624,13398,Assisted Living Facility,GOLDEN SWAN BY THE LAKE ALF,17331 SPRING TREE LANE,BOCA RATON,FL,33487,Palm Beach,(954) 867-8080,GOLDEN SWAN OF BOCA ALF INC,6,For-Profit
11969043,12872,Assisted Living Facility,GOLDEN SWAN OF BOCA ALF INC,19494 HAMPTON DR,BOCA RATON,FL,33434,Palm Beach,(954) 867-8080,GOLDEN SWAN OF BOCA ALF INC,6,For-Profit
11968923,13047,Assisted Living Facility,GOLDEN TOUCH ASSISTED LIVING FACILITY  LIMITED LIABILITY CORP.,1362 N SPARKMAN AVE,ORANGE CITY,FL,32763,Volusia,(386) 337-4090,GOLDEN TOUCH ASSISTED LIVING FACILITY  LIMITED LIABILITY CORP,6,For-Profit
11967151,11212,Assisted Living Facility,GOLDEN TOUCH HOME CARE,41 NW 190TH ST,MIAMI,FL,33169-4026,Miami-Dade,(305) 493-1508,MILLIEN ENTERPRISES,6,For-Profit
11965797,10192,Assisted Living Facility,GOLDEN YEARS ALF,321 WEST BLUE HERON BLVD,WEST PALM BEACH,FL,33404,Palm Beach,(561) 881-7615,GOLDEN YEARS ALF CORPORATION,40,For-Profit
11965545,9923,Assisted Living Facility,GOLDEN YEARS FOR THE ELDERLY CORP,13184 S.W. 19 TERRACE,MIAMI,FL,33175,Miami-Dade,(305) 229-7007,GOLDEN YEARS FOR THE ELDERLY CORP,6,For-Profit
11969826,13581,Assisted Living Facility,GOLDEN YEARS PARADISE  INC,2104 SW 106 CT,MIAMI,FL,33165,Miami-Dade,(786) 633-5123,Golden Years Paradise  INC.,6,For-Profit
11965663,10017,Assisted Living Facility,GONZALEZ & SON'S HOME CARE INC.,4045 SW 9TH TER,MIAMI,FL,33134-2633,Miami-Dade,(305) 443-9944,GONZALEZ AND SONS HOME CARE INC,6,Not-For-Profit
11966178,10420,Assisted Living Facility,GOOD FAMILY HOME  INC,6851 SW 79TH TER,MIAMI,FL,33143-4440,Miami-Dade,(786) 268-1039,GOOD FAMILY HOME INC,6,For-Profit
11953535,8627,Assisted Living Facility,GOOD HOPE MANOR,2251 NW 29TH CT,OAKLAND PARK,FL,33311-2147,Broward,(954) 677-2900,BETHEL HEALTH CARE CORP.,100,For-Profit
11966920,11047,Assisted Living Facility,GOOD LIFE ALF  INC,7746 NW 201ST TER,HIALEAH,FL,33015-6643,Miami-Dade,(786) 547-7116,GOOD LIFE ALF  INC,6,For-Profit
11969705,13479,Assisted Living Facility,GOOD OLE DAYS ADULT LIVING FACILITY LLC,3913 TROVATI ST,ORLANDO,FL,32839,Orange,(407) 242-3975,KOZETTE KING,5,For-Profit
11965709,10049,Assisted Living Facility,GOOD SAM'S ASSISTED LIVING RESIDENCE  LLC,1 PEBBLE WOOD LN,PALM COAST,FL,32164,Flagler,(386) 447-8145,GOOD SAM'S ASSISTED LIVING RESIDENCE  LLC,6,For-Profit
11966134,10381,Assisted Living Facility,GOOD SAMARITAN CARE CENTER ASSISTED LIVING FACILITY INC.,6 RESTON PLACE,PALM COAST,FL,32164,Flagler,(386) 437-6244,GOOD SAMARITAN CARE CENTER ASSISTED LIVING FACILITY  INC,6,For-Profit
11911795,5455,Assisted Living Facility,GOOD SAMARITAN SOCIETY-FLORIDA LUTHERAN (THE),436 NORTH MCDONALD AVENUE,DELAND,FL,32724,Volusia,(386) 736-5800,EVANGELICAL LUTHERAN GOOD SAMARITAN SOCIETY,90,Not-For-Profit
11967421,11484,Assisted Living Facility,GOOD SAMARITAN SOCIETY-KISSIMMEE VILLAGE,1471 SUNGATE DRIVE,KISSIMMEE,FL,34746,Osceola,(407) 931-5143,EVANGELICAL LUTHERAN GOOD SAMARITAN SOCIETY,44,Not-For-Profit
11963850,8722,Assisted Living Facility,GOOD SHEPARDS OF DELAND-WEST (THE),1200 W. NEW YORK AVENUE,DELAND,FL,32720,Volusia,(386) 738-9986,DELAND GERIATRIC CARE  INC.,11,For-Profit
11964382,9000,Assisted Living Facility,GOOD SHEPHERD ALF OF BRANDON LLC,1801 LIDO DR,BRANDON,FL,33511-6824,Hillsborough,(813) 684-4989,GOOD SHEPHERD ALF OF BRANDON LLC,6,For-Profit
11967063,11262,Assisted Living Facility,GOOD STAND HOME CARE INC,721 NW 13TH AVE,MIAMI,FL,33125-3742,Miami-Dade,(786) 452-0597,GOOD STAND HOME CARE INC,14,For-Profit
11967944,11945,Assisted Living Facility,GORDON HEIGHTS  INCORPORATED,9500 NW 80TH ST,TAMARAC,FL,33321-1306,Broward,(954) 721-4309,GORDON HEIGHTS  INCORPORATED,6,For-Profit
11967602,11587,Assisted Living Facility,GRACE ASSISTED LIVING FACILITY LLC,6746 MASSACHUSETTS DR,LAKE WORTH,FL,33462-3836,Palm Beach,(561) 966-9535,GRACE ASSISTED LIVING FACILITY LLC,5,For-Profit
11968994,12849,Assisted Living Facility,GRACE ASSISTED LIVING  LLC,22091 PEACHLAND BLVD,PORT CHARLOTTE,FL,33954,Charlotte,(941) 766-7178,Grace Assisted Living LLC,6,For-Profit
11966123,10394,Assisted Living Facility,GRACE CARE FAMILY HOME  CORP,4221 W 5TH LN,HIALEAH,FL,33012-3811,Miami-Dade,(305) 557-0800,GRACE CARE FAMILY HOME CORP,6,For-Profit
11968657,12677,Assisted Living Facility,GRACE HOME LIVING FACILITY LLC,2821 HUNT STR,JACKSONVILLE,FL,32254,Duval,(904) 673-7212,Grace Home Living Facility LLC,5,For-Profit
11968588,12472,Assisted Living Facility,GRACE HOUSE OF TAMPA,13315 ORANGE GROVE DR,TAMPA,FL,33618,Hillsborough,(813) 962-2589,GRACE HOUSE OF TAMPA INC,6,For-Profit
11969544,13334,Assisted Living Facility,GRACE MANOR,221 SW YAGER PL,PORT SAINT LUCIE,FL,34953,St. Lucie,(772) 812-8749,GRACE SENIOR LIVING LLC,6,For-Profit
11969521,13292,Assisted Living Facility,GRACE MANOR AT HUNTERS CREEK  LLC,765 W GRANT ST,PLANT CITY,FL,33563,Hillsborough,(813) 743-3701,GRACE MANOR AT HUNTERS CREEK LLC,76,For-Profit
11910053,5217,Assisted Living Facility,GRACE MANOR AT LAKE MORTON  LLC,610 E LIME ST,LAKELAND,FL,33801-5444,Polk,(863) 937-9114,GRACE MANOR AT LAKE MORTON LLC,50,For-Profit
11968049,11995,Assisted Living Facility,GRACE MANOR SUITES  LLC,4620 N SOCRUM LOOP RD,LAKELAND,FL,33809-4203,Polk,(863) 577-0977,GRACE MANOR SUITES LLC,77,For-Profit
11953221,8445,Assisted Living Facility,GRACE VILLA FACILITY  LLC,321 E. HARVARD STREET,ORLANDO,FL,32804,Orange,(407) 895-8418,GRACE VILLA FACILITY  LLC,11,For-Profit
11965923,10274,Assisted Living Facility,GRACIOUS AGE,1401 MAGNOLIA AVE,SANFORD,FL,32771,Seminole,(407) 323-9914,GRACIOUS AGE  LLC,85,For-Profit
11965527,9879,Assisted Living Facility,GRACIOUS LIVING,5600 SW 185TH WAY,SOUTHWEST RANCHES,FL,33332,Broward,(954) 680-1554,GOLDEN AGE SANCTUARY  INC.,8,For-Profit
11969293,13105,Assisted Living Facility,GRANADA ALF LLC,11935 SW 49TH ST,MIAMI,FL,33175,Miami-Dade,(786) 534-5268,GRANADA ALF  LLC,6,For-Profit
11943145,7140,Assisted Living Facility,GRAND BOULEVARD HEALTH AND REHABILITATION CENTER,138 SANDESTIN LN,MIRAMAR BEACH,FL,32550,Walton,(850) 267-2887,FL HUD DESTIN  LLC,16,For-Profit
11953671,8390,Assisted Living Facility,GRAND COURT LAKES,280 SIERRA DRIVE,NORTH MIAMI,FL,33179-4961,Miami-Dade,(305) 654-5300,YMP GRAND COURT LAKES OPCO LLC,191,For-Profit
11969235,13042,Assisted Living Facility,GRAND LIVING AT CITRUS HILLS,850 W NORVELL BRYANT HWY,HERNANDO,FL,34442,Citrus,(352) 301-8500,SHP V/RYAN CITRUS HILLS LLC,200,For-Profit
11969594,13373,Assisted Living Facility,GRAND LIVING AT LAKEWOOD RANCH,7230 UNIVERSITY PARKWAY,SARASOTA,FL,34240,Sarasota,(941) 554-7230,SARASOTA PROPERTY OWNER  LLC,308,For-Profit
11969553,13324,Assisted Living Facility,GRAND LIVING AT TAMAYA,3270 TAMAYA BLVD,JACKSONVILLE,FL,32246,Duval,(904) 410-8500,Tamaya Senior Living LLC,215,For-Profit
11967991,11944,Assisted Living Facility,GRAND OAKS,203 SE 2ND ST,OKEECHOBEE,FL,34974,Okeechobee,(863) 824-6770,GRAND OAKS OF OKEECHOBEE  INC,37,For-Profit
11968722,12585,Assisted Living Facility,GRAND OAKS OF JENSEN BEACH,125 NW JENSEN BEACH BLVD,JENSEN BEACH,FL,34957,Martin,(772) 286-1844,GRAND OAKS OF JENSEN BEACH  LLC,66,For-Profit
11969093,12919,Assisted Living Facility,GRAND OAKS OF PALM CITY LLC,3550 SW CORPORATE PKWY,PALM CITY,FL,34990,Martin,(772) 529-6000,GRAND OAKS OF PALM CITY  LLC,88,For-Profit
11968453,12329,Assisted Living Facility,GRAND PALMS ALF OPERATOR  LLC,600 N ECONLOCKHATCHEE TRAIL,ORLANDO,FL,32825,Orange,(407) 529-1000,GRAND PALMS ALF OPERATOR LLC,55,For-Profit
11910126,7103,Assisted Living Facility,GRAND VILLA OF ALTAMONTE SPRINGS,433 ORANGE DRIVE,ALTAMONTE SPRINGS,FL,32701,Seminole,(407) 260-2433,433 ORANGE DRIVE  INC,180,For-Profit
11932640,8189,Assisted Living Facility,GRAND VILLA OF BOYNTON BEACH,1935 SOUTH FEDERAL HIGHWAY,BOYNTON BEACH,FL,33435,Palm Beach,(561) 736-2424,GV BOYNTON BEACH  LLC,148,For-Profit
11964130,6670,Assisted Living Facility,GRAND VILLA OF CLEARWATER,2750 DREW ST,CLEARWATER,FL,33759-3034,Pinellas,(727) 330-4992,GV CLEARWATER  LLC,200,For-Profit
11963790,8697,Assisted Living Facility,GRAND VILLA OF DEERFIELD BEACH,1050 SW 24TH AVE,DEERFIELD BEACH,FL,33442-7601,Broward,(954) 360-7667,GV DEERFIELD BEACH LLC,240,For-Profit
11968957,12792,Assisted Living Facility,GRAND VILLA OF DELAND,350 E INTERNATIONAL SPEEDWAY BLVD,DELAND,FL,32724,Volusia,(386) 738-5200,GV DELAND  LLC,170,For-Profit
11910377,5113,Assisted Living Facility,GRAND VILLA OF DELRAY EAST,14555 SIMS ROAD,DELRAY BEACH,FL,33484,Palm Beach,(561) 496-1111,GVDB OPERATIONS  LLC,170,For-Profit
11968466,12362,Assisted Living Facility,GRAND VILLA OF DELRAY WEST,5859 HERITAGE PARK WAY,DELRAY BEACH,FL,33484-8557,Palm Beach,(561) 499-7744,GV DELRAY WEST  LLC,167,For-Profit
11910770,5404,Assisted Living Facility,GRAND VILLA OF DUNEDIN,880 PATRICIA AV,DUNEDIN,FL,34698,Pinellas,(727) 734-4696,GV DUNEDIN  LLC,120,For-Profit
11911225,5501,Assisted Living Facility,GRAND VILLA OF ENGLEWOOD,925 SOUTH RIVER ROAD,ENGLEWOOD,FL,34223,Sarasota,(941) 474-8600,GV ENGLEWOOD LLC,216,For-Profit
11910091,6107,Assisted Living Facility,GRAND VILLA OF LAKELAND,2111 LAKELAND HILLS BLVD,LAKELAND,FL,33805-2905,Polk,(863) 688-1126,GV LAKELAND LLC,95,For-Profit
11910247,7301,Assisted Living Facility,GRAND VILLA OF LARGO,750 STARKEY ROAD,LARGO,FL,33771,Pinellas,(727) 586-0108,GV LARGO INC,143,For-Profit
11968003,11991,Assisted Living Facility,GRAND VILLA OF MELBOURNE,964 S HARBOUR CITY BLVD,MELBOURNE,FL,32901,Brevard,(321) 725-0300,GV MELBOURNE  INC,155,For-Profit
11953686,4832,Assisted Living Facility,GRAND VILLA OF NEW PORT RICHEY,6120 CONGRESS STREET,NEW PORT RICHEY,FL,34652,Pasco,(727) 848-3617,GV NEW PORT RICHEY  LLC,126,For-Profit
11910336,7460,Assisted Living Facility,GRAND VILLA OF ORMOND BEACH,535 NORTH NOVA ROAD,ORMOND BEACH,FL,32174,Volusia,(386) 673-5000,GV-ORMOND  LLC,115,For-Profit
11967189,11267,Assisted Living Facility,GRAND VILLA OF PALM COAST,100 MAGNOLIA TRACE WAY,PALM COAST,FL,32164-2382,Flagler,(386) 445-3500,GV PALM COAST  LLC,80,For-Profit
11942962,5487,Assisted Living Facility,GRAND VILLA OF PINELLAS PARK,8980 49TH ST N,PINELLAS PARK,FL,33782-5336,Pinellas,(727) 546-4053,GV PINELLAS PARK LLC,132,For-Profit
11942812,8261,Assisted Living Facility,GRAND VILLA OF SARASOTA,730 SOUTH OSPREY AVENUE,SARASOTA,FL,34236,Sarasota,(941) 955-4646,GV SARASOTA LLC,173,For-Profit
11968698,12561,Assisted Living Facility,GRAND VILLA OF ST PETERSBURG,3600 34TH ST S,SAINT PETERSBURG,FL,33711,Pinellas,(727) 350-5830,GV ST. PETE LLC,192,For-Profit
11964652,12365,Assisted Living Facility,GRANDAD ELDERLY CORP,7520 SW 108TH AVE,MIAMI,FL,33173-2718,Miami-Dade,(305) 338-9881,GRANDAD ELDERLY CORP,6,For-Profit
11967717,11727,Assisted Living Facility,GRANDMOTHER'S HOME CARE CORP,4651 NW 23RD CT,MIAMI,FL,33142-4615,Miami-Dade,(305) 638-7624,GRANDMOTHER'S HOME CARE CORP.,6,For-Profit
11967889,11868,Assisted Living Facility,GRANDPARENTS HOUSE ALF INC,3890 SW CHAFFIN STREET,PORT SAINT LUCIE,FL,34953,St. Lucie,(772) 879-9660,GRANDPARENTS HOUSE ALF INC,5,For-Profit
11964733,9275,Assisted Living Facility,GRANDVIEW ASSISTED LIVING OF NORTH FLORIDA LLC,3250 DOUGLAS FERRY ROAD,BONIFAY,FL,32425,Washington,(850) 547-0692,GRANDVIEW ASSISTED LIVING OF NORTH FLORIDA  LLC,16,For-Profit
11932670,7371,Assisted Living Facility,GRANDVIEW RETIREMENT CENTER,1706 E OLIVE ROAD,PENSACOLA,FL,32514-7553,Escambia,8504774929,RSL LIVING PENSACOLA LLC,85,For-Profit
11969262,13073,Assisted Living Facility,GRANNIE'S HOME ALF INC,5554 PENTAIL CIR,TAMPA,FL,33625,Hillsborough,(813) 363-2530,GRANNIE'S HOME ALF INC,6,For-Profit
11968679,12558,Assisted Living Facility,GRANNY'S GARDEN HOME ALF  LLC,11173 SW 112 TERRACE,MIAMI,FL,33176,Miami-Dade,(786) 250-3345,GARDENIA HOME ALF LLC,6,For-Profit
11969697,13511,Assisted Living Facility,GRANNYS ALF,3840 NW 184 ST,MIAMI GARDENS,FL,33055,Miami-Dade,(305) 974-2590,Granny's ALF,6,For-Profit
11969858,13597,Assisted Living Facility,GREATER CARROLLWOOD ALF,4007 HUDSON LN,TAMPA,FL,33618,Hillsborough,(813) 808-6614,GREATER CARROLLWOOD ALF INC,6,For-Profit
11967964,11922,Assisted Living Facility,GREEN ACRES ALF,2644 FRITZKE RD,DOVER,FL,33527-3433,Hillsborough,(813) 986-6157,GREEN ACRES ASSISTED LIVING CORPORATION,6,For-Profit
11965497,9844,Assisted Living Facility,GREEN GABLES ASSISTED LIVING,1934 22ND AVENUE,VERO BEACH,FL,32966,Indian River,(772) 794-1277,FAMILY EXTENDED CARE OF VERO BEACH  INC.,32,Not-For-Profit
11968725,12577,Assisted Living Facility,GREEN LIFE ASSISTED LIVING FACILITY LLC,840 SW 8TH STREET,POMPANO BEACH,FL,33060,Broward,(855) 331-6615,GREEN LIFE ASSISTED LIVING FACILITY  LLC,71,For-Profit
11968958,12805,Assisted Living Facility,GREEN STREET ALF  CORP,12262 SW 250 TERR,MIAMI,FL,33032,Miami-Dade,(786) 274-0144,GREEN STREET ALF  CORP,6,For-Profit
11911279,5578,Assisted Living Facility,GREEN TREE ASSISTED LIVING  LLC,8207 FOREST CITY ROAD,ORLANDO,FL,32810,Orange,(407) 295-4861,GREEN TREE ASSISTED LIVING  LLC,76,For-Profit
11910231,6645,Assisted Living Facility,GREENBRIAR MANOR,7555 131 ST NO,SEMINOLE,FL,33776,Pinellas,(727) 398-0880,ROY S BRITO,12,For-Profit
11964457,9202,Assisted Living Facility,GREENBRIAR RETIREMENT HOME,3615 MCNEIL ROAD,APOPKA,FL,32703,Seminole,(407) 292-6771,BAGSIYAO CORPORATION,25,For-Profit
11932406,8051,Assisted Living Facility,GREENLEAF ASSISTED LIVING  LLC,509 WEST VERONA STREET,KISSIMMEE,FL,34741,Osceola,(407) 931-3995,KONA PROPERTIES  LLC,75,For-Profit
11964204,8885,Assisted Living Facility,GREENWOOD PLACE,2680 CROTON ROAD,MELBOURNE,FL,32935,Brevard,(321) 255-5443,AMERICAN EAGLE EAU GALLIE LLC,80,For-Profit
11967658,11658,Assisted Living Facility,GREYNOLDS ASSISTED LIVING FACILITY,3010 GREYNOLDS AVENUE,SPRING HILL,FL,34608,Hernando,(352) 346-6970,GREYNOLDS ASSISTED LIVING FACILITY LLC,5,For-Profit
11910299,89,Assisted Living Facility,GROVES AT ALLIANCE COMMUNITY (THE),638 SOUTH WOODLAND BLVD,DELAND,FL,32720,Volusia,(386) 734-3481,THE ALLIANCE COMMUNITY FOR RETIREMENT LIVING  INC.,54,Not-For-Profit
11966064,10322,Assisted Living Facility,GUARDIAN ELDER CARE SERVICES  INC. (THE),8318 SW 162ND PL,MIAMI,FL,33193-5130,Miami-Dade,(305) 388-1655,GUARDIAN ELDER CARE SERVICES  INC. (THE),6,For-Profit
11943002,5629,Assisted Living Facility,GUARDIAN HOME ALF  LLC,431 E. AIRPORT BLVD.,SANFORD,FL,32773-5494,Seminole,(407) 323-2545,ALMR LLC,15,For-Profit
11967154,11282,Assisted Living Facility,GUARDIAN HOME HEALTH INC,12452 BARROW ST,SPRING HILL,FL,34609-4904,Hernando,(352) 688-8832,GUARDIAN HOME HEALTH INC.,6,For-Profit
11910317,55,Assisted Living Facility,GUARDIAN HOME II ALF LLC,902 CANAL ST,NEW SMYRNA,FL,32168-6941,Volusia,(386) 409-9456,GUARDIAN HOME II ALF LLC,11,For-Profit
11953442,8523,Assisted Living Facility,GUIDANCE CARE CENTER INC,67 COCO PLUM DR,MARATHON,FL,33050,Monroe,(305) 743-4129,GUIDANCE/CARE CENTER  INC.,14,Not-For-Profit
11965638,9968,Assisted Living Facility,GULF HAVEN  INC,6343 ROWAN RD,NEW PRT RCHY,FL,34653-3402,Pasco,(727) 849-6810,GULF HAVEN INC,23,For-Profit
11969101,12921,Assisted Living Facility,GULL POINT AT ESTERO,22900 LYDEN DR,ESTERO,FL,33928,Lee,(239) 221-6120,LBC ESTERO LLC,56,For-Profit
11968391,12383,Assisted Living Facility,GWK HOME OF COMFORT LLC,7944 CECIL STREET,JACKSONVILLE,FL,32221,Duval,(904) 695-2673,GWK HOME OF COMFORT LLC,6,For-Profit
11969107,12930,Assisted Living Facility,GWK HOME OF COMFORT LLC II,7631 CREST DR N,JACKSONVILLE,FL,32221,Duval,(904) 647-7370,GWK HOME OF COMFORT LLC,6,For-Profit
11969758,13525,Assisted Living Facility,H2 LIVE INC,16011 SW 144TH TERR,MIAMI,FL,33196,Miami-Dade,(305) 915-1187,H2 Live INC.,6,For-Profit
11968096,12164,Assisted Living Facility,HACIENDA VILLAS,1510 E PALM AVE,TAMPA,FL,33605-3715,Hillsborough,(813) 248-9640,HACIENDA VILLAS  INC.,36,Not-For-Profit
11964923,9679,Assisted Living Facility,HAINAT  INC,2435 SW 82 AVENUE,MIAMI,FL,33155,Miami-Dade,(305) 267-5404,HAINAT INC,6,For-Profit
11965596,9965,Assisted Living Facility,HAINES MANOR ALF,301 S 10TH ST,HAINES CITY,FL,33844-5601,Polk,(863) 547-4440,HAINES ALF MANAGEMENT LLC,109,For-Profit
11964374,8927,Assisted Living Facility,HAMPTON ALF AT 24TH ROAD LLC,1500 SE 24TH ROAD,OCALA,FL,34471,Marion,(352) 732-1122,HAMPTON ALF AT 24TH ROAD LLC,60,For-Profit
11953326,8503,Assisted Living Facility,HAMPTON ALF AT BELLEVIEW LLC,10590 SE 62ND AVENUE,BELLEVIEW,FL,34420,Marion,(352) 245-6201,HAMPTON ALF AT BELLEVIEW LLC,65,For-Profit
11966441,10647,Assisted Living Facility,HAMPTON ALF AT DEERWOOD LLC,1810 SE 16TH AVENUE,OCALA,FL,34471,Marion,(352) 387-1046,HAMPTON ALF AT DEERWOOD LLC,73,For-Profit
11966931,11043,Assisted Living Facility,HAMPTON COURT ASSISTED LIVING,7801 NW 45TH CT,LAUDERHILL,FL,33351-5751,Broward,(954) 748-9282,HAMPTON COURT ASSISTED LIVING  INC.,6,For-Profit
11969729,13501,Assisted Living Facility,HAMPTON MANOR OF CAPE CORAL,1906 SKYLINE BLVD,CAPE CORAL,FL,33991,Lee,(239) 360-8985,CORAL LAND HOLDINGS LLC,130,For-Profit
11968111,12086,Assisted Living Facility,HAMPTONS LUXURY VILLAS INC,10695 HAMPTON ROAD,JACKSONVILLE,FL,32257,Duval,(904) 232-8575,HAMPTON'S LUXURY VILLAS INC.,6,For-Profit
11968100,12037,Assisted Living Facility,HANNAH'S HOME  LLC,997 LYONS CIR NW,PALM BAY,FL,32907,Brevard,(954) 993-0244,HANNAH'S HOME LLC,5,For-Profit
11964605,9130,Assisted Living Facility,HAPPY ACRES ASSISTED LIVING FACILITY INC,700 ANDERSON DRIVE,BONIFAY,FL,32425,Holmes,(850) 547-3708,HAPPY ACRES ASSISTED LIVING FACILITY  INC.,56,For-Profit
11967495,11541,Assisted Living Facility,HAPPY LIFE ALF INC,14785 COOLIDGE LN,HOMESTEAD,FL,33033-2710,Miami-Dade,(305) 247-5949,HAPPY LIFE ALF  INC,6,For-Profit
11969802,13552,Assisted Living Facility,HAPPY PARENTS ALF 1 INC,11871 SW 178TH TER,MIAMI,FL,33186,Miami-Dade,(305) 232-6514,Happy Parents ALF 1 INC.,6,For-Profit
11967425,11481,Assisted Living Facility,HAPPY PLACE GROUP HOME INC,12216 SW 10TH TERRACE,MIAMI,FL,33184,Miami-Dade,(305) 228-8861,HAPPY PLACE GROUP HOME INC,6,For-Profit
11968876,12709,Assisted Living Facility,HARBLIN ASSISTED LIVING FACILITY,1691 PARKGLEN CIR,APOPKA,FL,32712,Orange,(321) 276-6441,HARBLIN  LLC.,6,For-Profit
11942766,8268,Assisted Living Facility,HARBOR INN OF VENICE INC,321 HARBOR DRIVE,VENICE,FL,34285,Sarasota,(941) 488-1492,HARBOR INN OF VENICE  INC.,10,For-Profit
11965273,9691,Assisted Living Facility,HARBOR INN OF VENICE SOUTH,160 RUTLAND ROAD,VENICE,FL,34293,Sarasota,(941) 488-6565,HARBOR INN OF VENICE  INC.,6,For-Profit
11911191,5650,Assisted Living Facility,HARBOR OAKS GOLDEN YEARS,158 FARMBROOK ROAD,PORT ORANGE,FL,32127,Volusia,(386) 767-1613,MLCKM LLC,40,For-Profit
11965695,10035,Assisted Living Facility,HARBOR PLACE AT PORT ST LUCIE  THE,3700 SE JENNINGS RD,PORT ST LUCIE,FL,34952-7701,St. Lucie,(772) 337-4330,PORT ST LUCIE RETIREMENT INVESTORS  LLC,128,For-Profit
11964731,9270,Assisted Living Facility,HARBOR POINT ALF INC,1045 HARBOR LAKE DR,SAFETY HARBOR,FL,34695-2311,Pinellas,(727) 463-9085,HARBOR POINT ALF INC,14,For-Profit
