Facility Name,Facility ID,License Number,Phone Number,Email Address,Address,City,State,Zip Code,County,Capacity,Licensee,State Facility Type 1 Literal
RANDALL RESIDENCE OF NEWARK,OHL01167,2127R,7403665271,bsm@randallresidence.com,1065 JOHNSON AVENUE,NEWARK,OH,43055,LICKING,45,"RANDALL RESIDENCE OF NEWARK, LLC",Residential Care Facility
RANDALL RESIDENCE OF NEWARK,OHL01167,2127R,7403665271,bsm@randallresidence.com,1065 JOHNSON AVENUE,NEWARK,OH,43055,LICKING,45,"SL NEWARK, LLC",Residential Care Facility
RANDALL RESIDENCE OF TIFFIN,OHL00847,2121R,4194438184,mgd@randallresidence.com,781 SOUTH GREENFIELD ROAD,TIFFIN,OH,44883,SENECA,45,"RANDALL RESIDENCE OF TIFFIN, LLC",Residential Care Facility
RANDALL RESIDENCE OF TIFFIN,OHL00847,2121R,4194438184,mgd@randallresidence.com,781 SOUTH GREENFIELD ROAD,TIFFIN,OH,44883,SENECA,45,"SL TIFFIN, LLC",Residential Care Facility
RANDALL RESIDENCE OF TIPP CITY,OHL41719,2642R,9376678200,csr@randallresidence.com,6400 SOUTH COUNTY ROAD 25A,TIPP CITY,OH,45371,MIAMI,135,RANDALL RESIDENCE OF TIPP CITY LLC,Residential Care Facility
RANDALL RESIDENCE OF TROY,OHL01908,2115R,9373395199,jma@randallresidence.com,2900 CORPORATE DRIVE,TROY,OH,45373,MIAMI,49,"SL TROY, LLC",Residential Care Facility
RANDALL RESIDENCE OF TROY,OHL01908,2115R,9373395199,jma@randallresidence.com,2900 CORPORATE DRIVE,TROY,OH,45373,MIAMI,49,"RANDALL RESIDENC OF TROY, LLC",Residential Care Facility
RANDALL RESIDENCE OF WHEELERSBURG,OHL01168,2129R,7405741399,kkr@randallresidence.com,900 PIRATE DRIVE,WHEELERSBURG,OH,45694,SCIOTO,45,"RANDALL RESIDENCE OF WHEELERSBURG, LLC",Residential Care Facility
RANDALL RESIDENCE OF WHEELERSBURG,OHL01168,2129R,7405741399,kkr@randallresidence.com,900 PIRATE DRIVE,WHEELERSBURG,OH,45694,SCIOTO,45,"SL WHEELERBURG, LLC",Residential Care Facility
RED CARPET HEALTH CARE CENTER,OHL01338,1615R,7404394401,amorris@cambridgeehcs.com,8420 GEORGETOWN ROAD,CAMBRIDGE,OH,43725,GUERNSEY,84,"EHCS CAMBRIDGE PROPERTIES, LLC",Residential Care Facility
RED CARPET HEALTH CARE CENTER,OHL01338,1615R,7404394401,amorris@cambridgeehcs.com,8420 GEORGETOWN ROAD,CAMBRIDGE,OH,43725,GUERNSEY,84,CAMBRIDGE HEALTHCARE AND REHAB CENTER LLC,Residential Care Facility
REFLECTIONS RETIREMENT COMMUNITY,OHL41706,2635R,7406531423,moliva@pathwaytoliving.com,2750 WEST FAIR AVENUE,LANCASTER,OH,43130,FAIRFIELD,58,"NRFHC-LANCASTER II OPS, LLC",Residential Care Facility
REFLECTIONS RETIREMENT COMMUNITY,OHL41706,2635R,7406531423,moliva@pathwaytoliving.com,2750 WEST FAIR AVENUE,LANCASTER,OH,43130,FAIRFIELD,58,"WELL PATH TENANT, LLC",Residential Care Facility
REGINA HEALTH CENTER,OHL00070,2001R,3306594161,myantek@reginahealthcenter.org,5232 BROADVIEW ROAD,RICHFIELD,OH,44286,SUMMIT,54,SISTER OF CHARITY OF ST. AUGUSTINE HEALTH SYSTEM,Residential Care Facility
REGINA HEALTH CENTER,OHL00070,2001R,3306594161,myantek@reginahealthcenter.org,5232 BROADVIEW ROAD,RICHFIELD,OH,44286,SUMMIT,54,REGINA HEALTH CENTER,Residential Care Facility
REISEN CENTER,OHL40801,2489R,4196339191,kgreear@pslgroupllc.com,1391 NORTH MAIN STREET,BRYAN,OH,43506,WILLIAMS,30,PREMIER OPERATING OHIO LLC,Residential Care Facility
RENAISSANCE ASSISTED LIVING,OHL41902,2717R,3303137000,kitty@renaissanceassistedliving.net,3975 EVERETT ROAD,RICHFIELD,OH,44286,SUMMIT,74,"LEGACY SENIOR MANAGEMENT GROUP,  LLC",Residential Care Facility
RENAISSANCE AT VISTA THE,OHL40430,2090R,3304245852,bparsons@continuinghc.com,100 VISTA DRIVE,LISBON,OH,44432,COLUMBIANA,19,"LISBON SKILLED NURSING AND RESIDENTIAL CARE, LLC",Residential Care Facility
RESERVE THE,OHL42044,2783R,3304682273,bclassen@brentwoodhcc.com,915 WEST AURORA ROAD,NORTHFIELD,OH,44067,SUMMIT,98,BRENTWOOD ASSISTED LIVING LLC,Residential Care Facility
RESIDENCE OF CHARDON THE,OHL03213,2290R,4402862277,cstraight@capitalseniorliving.net,501 CHARDON-WINDSOR ROAD,CHARDON,OH,44024,GEAUGA,52,"CSL CHARDON, LLC",Residential Care Facility
RICHMOND HEIGHTS PLACE - A CONTINUUM OF CARE COMMU,OHL00433,2274R,2162916140,michaelthomas@richmondheightsplace.com,3 HOMEWOOD WAY,RICHMOND HEIGHTS,OH,44143,CUYAHOGA,190,"HOMEWOOD SENIOR LIVING, LLC",Residential Care Facility
RICHMOND HEIGHTS PLACE - A CONTINUUM OF CARE COMMU,OHL00433,2274R,2162916140,michaelthomas@richmondheightsplace.com,3 HOMEWOOD WAY,RICHMOND HEIGHTS,OH,44143,CUYAHOGA,190,BROOKDALE SENIOR LIVING,Residential Care Facility
RICHMOND HEIGHTS PLACE - A CONTINUUM OF CARE COMMU,OHL00433,2274R,2162916140,michaelthomas@richmondheightsplace.com,3 HOMEWOOD WAY,RICHMOND HEIGHTS,OH,44143,CUYAHOGA,190,"ARC RICHMOND HEIGHTS, LLC",Residential Care Facility
RIDGE AT LANCASTER THE,OHL01189,2200R,7406819903,veronica.finnefrock@rdglancaster.com,241 WHITTIER DRIVE SOUTH,LANCASTER,OH,43130,FAIRFIELD,50,"HCF OF LANCASTER, INC.",Residential Care Facility
RIDGE AT LANCASTER THE,OHL01189,2200R,7406819903,veronica.finnefrock@rdglancaster.com,241 WHITTIER DRIVE SOUTH,LANCASTER,OH,43130,FAIRFIELD,50,"MW LANCASTER OPERATING, LLC",Residential Care Facility
RIDGE AT LANCASTER THE,OHL01189,2200R,7406819903,veronica.finnefrock@rdglancaster.com,241 WHITTIER DRIVE SOUTH,LANCASTER,OH,43130,FAIRFIELD,50,"BROOKDALE SENIOR LIVING COMMUNITIES, INC.",Residential Care Facility
RIVER OAKS ALZHEIMER'S SPECIAL CARE CENTER,OHL41935,2732R,9372911100,aleashia.wood@jeaseniorliving.com,2961 WEST SPRING VALLEY PIKE,MIAMISBURG,OH,45342,MONTGOMERY,66,"MIAMI TOWNSHIP CARE GROUP, LLC",Residential Care Facility
RIVERSIDE LANDING SKILLED NURSING & REHABILITATION,OHL40453,1595R,7409625303,marichards@continuinghc.com,856 SOUTH RIVERSIDE DRIVE,MC CONNELSVILLE,OH,43756,MORGAN,38,"RIVERSIDE CARE CENTER, LLC",Residential Care Facility
ROCHESTER PARK,OHL499878,1724R,3308792765,sarah.sonego@altercareonline.net,517 PARK STREET,NAVARRE,OH,44662,STARK,30,"TSG NURSING CENTER, INC.",Residential Care Facility
ROCHESTER PARK,OHL499878,1724R,3308792765,sarah.sonego@altercareonline.net,517 PARK STREET,NAVARRE,OH,44662,STARK,30,ALTERCARE OF NAVARRE CENTER FOR REHAB & NURSING,Residential Care Facility
ROCKPORT RETIREMENT COMMUNITY,OHL41130,2531R,4403565444,director@ehrockport.net,20375 CENTER RIDGE ROAD,ROCKY RIVER,OH,44116,CUYAHOGA,125,ROCKPORT RETIREMENT LIMITED PARTNERSHIP,Residential Care Facility
ROCKY RIVER VILLAGE,OHL00406,2233R,4403562282,cbare@rockyrivervillage.com,22900 CENTER RIDGE ROAD,ROCKY RIVER,OH,44116,CUYAHOGA,144,"ROCKY RIVER AL/MC, LLC",Residential Care Facility
ROCKY RIVER VILLAGE,OHL00406,2233R,4403562282,cbare@rockyrivervillage.com,22900 CENTER RIDGE ROAD,ROCKY RIVER,OH,44116,CUYAHOGA,144,"CSL HARBOR COURT, LLC",Residential Care Facility
ROSE SENIOR LIVING AVON,OHL41989,2760R,4409370757,mjgiovanetti@roseseniorliving.com,33200 HEALTH CAMPUS BLVD,AVON,OH,44011,LORAIN,125,"AVON SENIOR LIVING, L.L.C",Residential Care Facility
ROSE SENIOR LIVING BEACHWOOD,OHL42271,2896R,2163423200,schonda_grays@roseseniorliving.com,23611 HARVARD ROAD,BEACHWOOD,OH,44122,CUYAHOGA,160,"BEACHWOOD SENIOR LIVING, L.L.C.",Residential Care Facility
ROSELAWN MANOR,OHL41533,2587R,4196474115,administrator@roselawnmanor.com,420 EAST FOURTH STREET,SPENCERVILLE,OH,45887,ALLEN,17,"HCF OF ROSELAWN, INC",Residential Care Facility
ROYAL MEADOWS AT AUSTINBURG,OHL39972,2083R,4402753019,65-admin@atriumlivingcenters.com,2026 STATE ROUTE 45,AUSTINBURG,OH,44010,ASHTABULA,40,"AMDD, INC.",Residential Care Facility
ROYAL MEADOWS AT AUSTINBURG,OHL39972,2083R,4402753019,65-admin@atriumlivingcenters.com,2026 STATE ROUTE 45,AUSTINBURG,OH,44010,ASHTABULA,40,ABRAHAM & SHALLY SCHEARTZ,Residential Care Facility
ROYAL MEADOWS AT AUSTINBURG,OHL39972,2083R,4402753019,65-admin@atriumlivingcenters.com,2026 STATE ROUTE 45,AUSTINBURG,OH,44010,ASHTABULA,40,ROYAL MANOR HEALTH CARE,Residential Care Facility
ROYALTON WOODS,OHL00072,2009R,4405824111,ira@randallresidence.com,14277 STATE ROAD,NORTH ROYALTON,OH,44133,CUYAHOGA,80,"RANDALL RESIDENCE AT ROYALTON WOODS, LLC",Residential Care Facility
ROYALTON WOODS,OHL00072,2009R,4405824111,ira@randallresidence.com,14277 STATE ROAD,NORTH ROYALTON,OH,44133,CUYAHOGA,80,"ROYALTON SENIOR LIVING, INC.",Residential Care Facility
S.E.M. HAVEN HEALTH CARE CENTE,OHL01622,1722R,5132481270,jhall@semhaven.org,225 CLEVELAND AVENUE,MILFORD,OH,45150,CLERMONT,80,"S.E.M. HAVEN, INC.",Residential Care Facility
SAGE PARK ALZHEIMER'S SPECIAL CARE CENTER,OHL42024,2774R,6144766744,ginger.williams@sunshineret.com,5201 MORSE ROAD,GAHANNA,OH,43230,FRANKLIN,66,"GAHANNA CARE GROUP, LLC",Residential Care Facility
SAINT FRANCIS SENIOR MINISTRIES,OHL500080,0741R,4194472723,info@csjinitiatives.org,182 SAINT FRANCIS AVENUE,TIFFIN,OH,44883,SENECA,16,"CSJI - TIFFIN, INC",Residential Care Facility
SAINT FRANCIS SENIOR MINISTRIES,OHL500080,0741R,4194472723,info@csjinitiatives.org,182 SAINT FRANCIS AVENUE,TIFFIN,OH,44883,SENECA,16,"SAINT FRANIS HOME, INC.",Residential Care Facility
SAINT JOSEPH ASSISTED RESIDENCE,OHL01335,1587R,3308755562,sstrutner@stjsl.org,1882 KNOB STREET,LOUISVILLE,OH,44641,STARK,98,ROMAN CATHOLIC,Residential Care Facility
SAINT JOSEPH ASSISTED RESIDENCE,OHL01335,1587R,3308755562,sstrutner@stjsl.org,1882 KNOB STREET,LOUISVILLE,OH,44641,STARK,98,DIOCESE OF YOUNGSTOWN,Residential Care Facility
SAINT JOSEPH ASSISTED RESIDENCE,OHL01335,1587R,3308755562,sstrutner@stjsl.org,1882 KNOB STREET,LOUISVILLE,OH,44641,STARK,98,SAINT JOSEPH CARE CENTER,Residential Care Facility
SAINT LUKE LUTHERAN HOME FOR THE AGING,OHL500109,1252R,3304998341,kathleenchamplin@stllc.org,"220 APPLEGROVE STREET, NORTHEAST",NORTH CANTON,OH,44720,STARK,71,ST. LUKE LUTHERAN HOME FOR THE AGING,Residential Care Facility
"SAINT MARGARET HALL, INC",OHL500093,0816R,5137515880,jmurphy@stmargarethall.com,1960 MADISON ROAD,CINCINNATI,OH,45206,HAMILTON,35,"SAINT MARGARET HALL, INCORPORATED",Residential Care Facility
SALIDA WOODS ASSISTED LIVING,OHL00422,2257R,4402573866,jenellu@walsdc.com,7685 LAKE SHORE BLVD,MENTOR,OH,44060,LAKE,96,MENTOR EQUITY LLC,Residential Care Facility
SALIDA WOODS ASSISTED LIVING,OHL00422,2257R,4402573866,jenellu@walsdc.com,7685 LAKE SHORE BLVD,MENTOR,OH,44060,LAKE,96,"SALIDA WOODS ASSISTED LIVING, LTD",Residential Care Facility
SALIDA WOODS ASSISTED LIVING,OHL00422,2257R,4402573866,jenellu@walsdc.com,7685 LAKE SHORE BLVD,MENTOR,OH,44060,LAKE,96,NORTH SHORE PROPERTIES,Residential Care Facility
SAMARITAN VILLA,OHL00038,1409R,3307235716,jcollins@ahfohio.com,809 EAST WASHINGTON STREET,MEDINA,OH,44256,MEDINA,30,"AHF OHIO, INC.",Residential Care Facility
SANCTUARY AT TUTTLE CROSSING THE,OHL500089,2195R,6147608870,lwelsh@ahfohio.com,4880 TUTTLE ROAD,DUBLIN,OH,43017,FRANKLIN,56,"AHF OHIO, INC.",Residential Care Facility
SANCTUARY AT WILMINGTON PLACE THE,OHL40550,2452R,9372564663,jweiner@ahfohio.com,264 WILMINGTON AVENUE,DAYTON,OH,45420,MONTGOMERY,31,"AHF OHIO, INC.",Residential Care Facility
SANCTUARY GRANDE SENIOR LIVING LLC,OHL42002,2767R,3304704411,mthirion@danburyseniorliving.com,850 APPLEGROVE STREET NE,NORTH CANTON,OH,44720,STARK,168,"BROOKWOOD MANAGEMENT COMPANY, LLC",Residential Care Facility
SANCTUARY OF GENEVA LIMITED PARTNERSHIP,OHL39973,2349R,4404661770,adminsanctuary@winstream.net,200 COMMERCE PLACE,GENEVA,OH,44041,ASHTABULA,41,"SANCTUARY MANAGEMENT GROUP, LLC",Residential Care Facility
SARAH MOORE HOME,OHL01198,0601R,7403629641,aarnett@ohioliving.org,47 E. WILLIAM STREET,DELAWARE,OH,43015,DELAWARE,21,"SARAH MOORE HOME, INC. THE",Residential Care Facility
SCARLET OAKS CARE CENTER,OHL500094,0958R,5138610400,hlange@scarletoakshc.com,440 LAFAYETTE AVENUE,CINCINNATI,OH,45220,HAMILTON,92,SCARLET OAKS NURSING AND REHABILITATION CENTER LLC,Residential Care Facility
SCIOTO COMMUNITY,OHL499976,2378R,6144912000,toni.shreves@capitalhcn.com,433 OBETZ ROAD,COLUMBUS,OH,43207,FRANKLIN,64,CHS OF SCIOTO OPERATING COMPANY INC,Residential Care Facility
"SENIOR SUITES AT CENTURY FARMS, LLC",OHL42301,2910R,3308925300,staffing@seniorsuites-scc.com,1111 CANTON ROAD NW,CARROLLTON,OH,44615,CARROLL,69,"SENIOR SUITES AT CENTURY FARMS, LLC",Residential Care Facility
SENIOR SUITES AT ST CLAIR COMMONS,OHL42109,2815R,7404492700,staffing@seniorsuites-scc.com,101 DOROTHY PLACE,SAINT CLAIRSVILLE,OH,43950,BELMONT,120,"SENIOR SUITES AT ST. CLAIR COMMONS, LLC",Residential Care Facility
SERENE SUITES,OHL42253,2886R,5137455000,jagdish.bhati@theserenesuites.com,9870 REDHILL DRIVE,CINCINNATI,OH,45242,HAMILTON,66,"JAY HEALTHCARE MANAGEMENT, LLC",Residential Care Facility
SERENITY LIVING CENTER,OHL41924,2728R,4195233005,swebb@oakhavenrc.com,10170 ROAD 5-H,OTTAWA,OH,45875,PUTNAM,56,"OAK HAVEN RESIDENTIAL CARE, LLC",Residential Care Facility
SHAKER GARDENS ASSISTED LIVING,OHL00336,2047R,2167525600,jdegyansky@shakergardens.com,3550 NORTHFIELD ROAD,SHAKER HEIGHTS,OH,44122,CUYAHOGA,126,SHAKER GARDENS OPCO LLC,Residential Care Facility
SHAKER GARDENS ASSISTED LIVING,OHL00336,2047R,2167525600,jdegyansky@shakergardens.com,3550 NORTHFIELD ROAD,SHAKER HEIGHTS,OH,44122,CUYAHOGA,126,"MFF SOMERSET, LLC",Residential Care Facility
SHARONBROOKE,OHL00977,1878R,7403667333,atwyman@sharonbrooke.com,920 SHARON VALLEY ROAD,NEWARK,OH,43055,LICKING,125,"SHARONBROOKE INN MANAGEMENT CO., LLC",Residential Care Facility
SHEPHERD OF THE VALLEY - HOWLAND,OHL40040,2360R,3308569232,tsalvino@shepherdofthevalley.com,4100 NORTH RIVER ROAD,WARREN,OH,44484,TRUMBULL,100,SHEPHERD OF THE VALLEY LUTHERAN RETIREMENT SERVICE,Residential Care Facility
SHEPHERD OF THE VALLEY - LIBERTY,OHL42261,2890R,3305440771,rlimongi@shepherdofthevalley.com,1501 TIBBETTS-WICK ROAD,GIRARD,OH,44420,TRUMBULL,72,SHEPHERD OF THE VALLEY LUTHERAN RETIREMENT SERVICE,Residential Care Facility
SHEPHERD OF THE VALLEY-POLAND,OHL00359,2097R,3307267110,kstansloski@shepherdofthevalley.com,301 WESTERN RESERVE ROAD,POLAND,OH,44514,MAHONING,75,SHEPHERD OF THE VALLEY LUTHERAN RETIREMENT SERVICE,Residential Care Facility
SHURMER PLACE AT ALTENHEIM,OHL02964,2326R,4402383361,kschulz@altenheim.com,18821 SHURMER ROAD,STRONGSVILLE,OH,44136,CUYAHOGA,170,MEMBERS OF THE WEST SIDE DEUTSCHER FRAVEN VEREIN,Residential Care Facility
SHURMER PLACE AT ALTENHEIM,OHL02964,2326R,4402383361,kschulz@altenheim.com,18821 SHURMER ROAD,STRONGSVILLE,OH,44136,CUYAHOGA,170,WEST SIDE DEUTSCHER FRAUEN VEREIN,Residential Care Facility
SHURMER PLACE MEMORY ASSISTED LIVING,OHL42108,2814R,4402681048,eseese@altenheim.com,18545 SHURMER ROAD,STRONGSVILLE,OH,44136,CUYAHOGA,76,WEST SIDE DEUTSCHER FRAUEN VEREIN,Residential Care Facility
SINGLETON HEALTH CARE CENTER,OHL50034,0682R,2162318467,channaireland@gmail.com,1867 E 82ND STREET,CLEVELAND,OH,44103,CUYAHOGA,22,"IRELAND HEALTH CARE CENTER, INC.",Residential Care Facility
SLOVENE HOME FOR THE AGED,OHL41953,1189R,2164860268,slovene91@aol.com,18621 NEFF ROAD,CLEVELAND,OH,44119,CUYAHOGA,12,SLOVENE HOME FOR THE AGED,Residential Care Facility
SMITH'S MILL HEALTH CAMPUS,OHL42238,2878R,6142451060,karen.marzec@trilogyhs.com,7320 SMITH'S MILL ROAD,NEW ALBANY,OH,43054,FRANKLIN,41,"TRILOGY HEALTHCARE OF FRANKLIN III, LLC",Residential Care Facility
SOLON POINTE AT EMERALD RIDGE,OHL00401,2219R,4404983000,aldirector@ehsolonpointe.net,5625 EMERALD RIDGE PARKWAY,SOLON,OH,44139,CUYAHOGA,65,"SOLON POINTE AT EMERALD RIDGE, LLC",Residential Care Facility
SOUTH FRANKLIN CIRCLE,OHL41296,2554R,2167912387,cstruk@judsonsmartliving.org,16570 WARREN COURT,CHAGRIN FALLS,OH,44023,GEAUGA,44,SOUTH FRANKLIN CIRCLE,Residential Care Facility
SOUTHWEST COMMONS,OHL40314,2427R,4402383777,katied@walsdc.com,18090 PEARL RD,STRONGSVILLE,OH,44136,CUYAHOGA,99,"SOUTHWEST COMMONS ASSISTED LIVING, LTD.SOUTHWEST C",Residential Care Facility
"SPRENGER HEALTH CARE OF MASSILLON ALF, INC",OHL40004,1497R,3308372100,hh938@aol.com,"205 ROHR AVENUE, NW",MASSILLON,OH,44646,STARK,18,CHILDS INVESTMENT CO,Residential Care Facility
"SPRENGER HEALTH CARE OF MASSILLON ALF, INC",OHL40004,1497R,3308372100,hh938@aol.com,"205 ROHR AVENUE, NW",MASSILLON,OH,44646,STARK,18,"SPRENGER HEALTH CARE OF MASSILLON ALF, INC",Residential Care Facility
SPRING CREEK NURSING AND REHABILITATION CENTER,OHL00875,0297R,4196392581,mbrick@prestigehcg.com,430 NORTH BROADWAY STREET,GREEN SPRINGS,OH,44836,SENECA,36,EDEN SPRINGS NURSING AND REHABILITATION EAST LLC,Residential Care Facility
SPRING CREEK NURSING AND REHABILITATION CENTER,OHL00875,0297R,4196392581,mbrick@prestigehcg.com,430 NORTH BROADWAY STREET,GREEN SPRINGS,OH,44836,SENECA,36,"ELMWOOD CENTER, INC.",Residential Care Facility
SPRING CREEK NURSING AND REHABILITATION CENTER,OHL00875,0297R,4196392581,mbrick@prestigehcg.com,430 NORTH BROADWAY STREET,GREEN SPRINGS,OH,44836,SENECA,36,"SPRING CREEK NURSING AND REHABILITATION CENTER, LL",Residential Care Facility
SPRING HILLS MIDDLETOWN,OHL03197,2287R,5134249999,chimes@spring-hill.net,3851 TOWNE BOULEVARD,FRANKLIN,OH,45005,WARREN,107,"PRAM/MIDDLETOWN TE, LLC",Residential Care Facility
SPRING HILLS SINGING WOODS,OHL01945,2194R,9372741400,ecarroll@springhills.com,140 E. WOODBURY DRIVE,DAYTON,OH,45415,MONTGOMERY,140,"PRAM/SINGING WOODS TE, LLC",Residential Care Facility
SPRINGFIELD ASSISTED LIVING,OHL01645,1986R,9373991216,smaxel@assistedlivingofspringfield.com,2981 VESTER AVENUE,SPRINGFIELD,OH,45503,CLARK,140,SPRINGFIELD ALF LLC,Residential Care Facility
SPRINGFIELD MASONIC COMMUNITY,OHL01936,2133R,9375253000,aberardi@ohiomasonichome.org,2655 WEST NATIONAL ROAD,SPRINGFIELD,OH,45504,CLARK,190,"MASONIC HEALTH CARE, INC",Residential Care Facility
SPRINGFIELD NURSING AND INDEPENDENT LIVING,OHL41884,2708R,9373998311,fred.carpenter@saberhealth.com,404 EAST MCCREIGHT AVENUE,SPRINGFIELD,OH,45503,CLARK,16,"SPRINGFIELD HEALTHCARE GROUP, INC.",Residential Care Facility
ST CATHERINE'S MANOR OF FOSTORIA,OHL42184,1374R,4194358112,administrator@stcatherinesfostoria.com,25 CHRISTOPHER DRIVE,FOSTORIA,OH,44830,HANCOCK,15,"HCF OF FOSTORIA, INC.",Residential Care Facility
ST CLARE COMMONS,OHL41733,2638R,4199310050,hbates@chilivingcomm.org,12469 FIVE POINT ROAD,PERRYSBURG,OH,43551,WOOD,126,ST CLARE COMMONS,Residential Care Facility
ST LEONARD,OHL500120,1887R,9374397158,plipsey@chilivingcomm.org,8100 CLYO ROAD,CENTERVILLE,OH,45458,MONTGOMERY,220,FRANCISCAN SERVICES CORPORATION,Residential Care Facility
ST LUKE LUTHERAN COMMUNITY - PORTAGE LAKES,OHL41692,0670R,3306443914,joevannostran@stllc.org,615 LATHAM LANE,AKRON,OH,44319,SUMMIT,30,ST. LUKE LUTHERAN COMMUNITY - PORTAGE LAKES,Residential Care Facility
ST LUKE LUTHERAN COMMUNITY-MINERVA,OHL41621,2605R,3308685600,jspieler@stllc.org,4301 WOODALE AVENUE SE,MINERVA,OH,44657,STARK,60,ST. LUKE LUTHERAN COMMUNITY  MINERVA,Residential Care Facility
"ST MARTIN MANAGEMENT, LLC",OHL41579,2594R,4192816721,manager@martinhouseapt.com,625 CENTER STREET,ASHLAND,OH,44805,ASHLAND,85,"HOLLAND-ASHLAND APARTMENTS,LTD",Residential Care Facility
ST MARY OF THE WOODS,OHL40412,2439R,4409372700,71-administrator@atriumlivingcenters.com,35755 DETROIT ROAD,AVON,OH,44011,LORAIN,77,ATRIUM RETIREMENT CENTERS LLC,Residential Care Facility
ST.  AUGUSTINE TOWERS,OHL00380,2142R,2166347444,bnolan@st-aug.org,7821 LAKE AVENUE,CLEVELAND,OH,44102,CUYAHOGA,110,ST. AUGUSTINE MANOR DBA,Residential Care Facility
STELLAR CARE CAMPUS,OHL41518,2583R,7404720144,bryan@daybreakohio.com,47045 MOORE RIDGE ROAD,WOODSFIELD,OH,43793,MONROE,19,"ALS MONROE COUNTY, INC",Residential Care Facility
STELLAR CARE CAMPUS,OHL41518,2583R,7404720144,bryan@daybreakohio.com,47045 MOORE RIDGE ROAD,WOODSFIELD,OH,43793,MONROE,19,MONROE COUNTY CARE CENTER,Residential Care Facility
STELLAR CARE CAMPUS,OHL41518,2583R,7404720144,bryan@daybreakohio.com,47045 MOORE RIDGE ROAD,WOODSFIELD,OH,43793,MONROE,19,"MONROE COUNTY OPERATING, INC",Residential Care Facility
STONE CREEK ASSISTED LIVING AND MEMORY CARE ,OHL41873,2703R,3305961272,cboone@stonecreekals.com,1280 SOUTH SAWBURG AVENUE,ALLIANCE,OH,44601,STARK,48,"DANBURY WOODS ALLIANCE, LLC",Residential Care Facility
STONE CREEK ASSISTED LIVING AND MEMORY CARE ,OHL41873,2703R,3305961272,cboone@stonecreekals.com,1280 SOUTH SAWBURG AVENUE,ALLIANCE,OH,44601,STARK,48,"STONE CREEK ALLIANCE, INC.",Residential Care Facility
STONE GARDENS ASSISTED LIVING,OHL00327,2031R,2162920070,tweiss@menorahpark.org,27090 CEDAR ROAD,BEACHWOOD,OH,44122,CUYAHOGA,160,"MENORAH PARK, BET MOSHAV ZEKENIM HADAT",Residential Care Facility
STORY POINT OF TROY,OHL42035,2780R,9374403607,hfogle@storypoint.com,1840 TOWNE PARK DRIVE,TROY,OH,45373,MIAMI,104,"SENIOR LIVING TROY, LLC",Residential Care Facility
STORYPOINT FAIRFIELD,OHL42269,2894R,5134388753,jnell@storypoint.com,7129 GILMORE ROAD,FAIRFIELD,OH,45011,BUTLER,46,"SENIOR LIVING FAIRFIELD, LLC",Residential Care Facility
STORYPOINT OF GROVE CITY,OHL42127,2825R,6148756500,jshockley@storypoint.com,3717 ORDERS ROAD,GROVE CITY,OH,43123,FRANKLIN,122,"SENIOR LIVING GROVE CITY, LLC",Residential Care Facility
STORYPOINT WATERVILLE,OHL42160,2844R,4198781000,bdejonghe@storypoint.com,1470 PRAY BOULEVARD,WATERVILLE,OH,43566,LUCAS,40,"SENIOR LIVING WATERVILLE, LLC",Residential Care Facility
STOW GLEN ASSISTED LIVING,OHL00043,1797R,3306867100,bdelp@stowglen.com,4285 KENT ROAD,STOW,OH,44224,SUMMIT,90,"STOW-GLEN, INC.",Residential Care Facility
STRATFORD COMMONS ASSISTED LIVING,OHL03224,2344R,4409140900,gmayer@gcapmgmt.com,7000 COCHRAN ROAD,GLENWILLOW,OH,44139,CUYAHOGA,64,KND DEVELOPMENT 51 LLC,Residential Care Facility
STRATFORD COMMONS ASSISTED LIVING,OHL03224,2344R,4409140900,gmayer@gcapmgmt.com,7000 COCHRAN ROAD,GLENWILLOW,OH,44139,CUYAHOGA,64,"STRATFORD COMMONS LEASING, LLC",Residential Care Facility
STRATFORD COMMONS ASSISTED LIVING,OHL03224,2344R,4409140900,gmayer@gcapmgmt.com,7000 COCHRAN ROAD,GLENWILLOW,OH,44139,CUYAHOGA,64,"STRAT OP, LLC",Residential Care Facility
SUITES AT CONTINUING HEALTHCARE OF NILES THE,OHL00392,1847R,3306526745,bparsons@continuinghc.com,2567 NILES-VIENNA ROAD,NILES,OH,44446,TRUMBULL,95,"NILES RESIDENTIAL CARE, LLC",Residential Care Facility
SUITES AT HAWTHORN GLEN THE,OHL01886,1936R,5138637775,mbarton@hawthornglennc.com,5414 HANKINS ROAD,MIDDLETOWN,OH,45044,BUTLER,92,"SEMMA ENTERPRISES, INC.",Residential Care Facility
SUITES AT WALNUT CREEK THE,OHL32948,2343R,9372990194,hochwaltj@wcreekoh.com,2501 KEYSTONE CLUB DRIVE,KETTERING,OH,45439,MONTGOMERY,190,MARINER MANAGEMENT,Residential Care Facility
SUITES AT WALNUT CREEK THE,OHL32948,2343R,9372990194,hochwaltj@wcreekoh.com,2501 KEYSTONE CLUB DRIVE,KETTERING,OH,45439,MONTGOMERY,190,PAUL DEPALMA,Residential Care Facility
SUITES AT WALNUT CREEK THE,OHL32948,2343R,9372990194,hochwaltj@wcreekoh.com,2501 KEYSTONE CLUB DRIVE,KETTERING,OH,45439,MONTGOMERY,190,"APRIL ENTERPRISES, INC.",Residential Care Facility
"SUMMIT ACRES, INC",OHL41992,1250R,7407322364,britney.cowgill@altercareonline.net,44565 SUNSET ROAD,CALDWELL,OH,43724,NOBLE,26,"SUMMIT ACRES, INC.",Residential Care Facility
SUMMIT POINT,OHL40992,2508R,3307484204,yowens@capitalseniorliving.net,9633  VALLEY VIEW ROAD,MACEDONIA,OH,44056,SUMMIT,133,"CSL SUMMIT POINT, LLC",Residential Care Facility
SUMMIT'S TRACE HEALTHCARE CENTER,OHL00966,1061R,6142574331,lwelsh@solivitahc.com,935 NORTH CASSADY AVENUE,COLUMBUS,OH,43219,FRANKLIN,111,"PEREGRINE HEALTH SERVICES OF COLUMBUS, LLC",Residential Care Facility
SUMMIT'S TRACE HEALTHCARE CENTER,OHL00966,1061R,6142574331,lwelsh@solivitahc.com,935 NORTH CASSADY AVENUE,COLUMBUS,OH,43219,FRANKLIN,111,"PGN OP SUMMIT, LLC",Residential Care Facility
SUNRISE ASSISTED LIVING OF FINDLAY,OHL03188,2175R,4194253440,findlay.ed@sunriseseniorliving.com,401 LAKE CASCADES PARKWAY,FINDLAY,OH,45840,HANCOCK,79,"KARRINGTON OPERATING COMPANY, INC.",Residential Care Facility
SUNRISE AT PARMA,OHL03221,2289R,2164478909,parma.ed@sunriseseniorliving.com,7766  BROADVIEW ROAD,PARMA,OH,44134,CUYAHOGA,74,"SZR PARMA ASSISTED LIVING OPCO, LLC",Residential Care Facility
SUNRISE AT PARMA,OHL03221,2289R,2164478909,parma.ed@sunriseseniorliving.com,7766  BROADVIEW ROAD,PARMA,OH,44134,CUYAHOGA,74,SZR PARMA ASSISTED LIVING LLC,Residential Care Facility
SUNRISE OF CUYAHOGA FALLS,OHL03219,2294R,3309298500,cuyahogafalls.ed@sunriseseniorliving.com,1500 STATE ROAD,CUYAHOGA FALLS,OH,44223,SUMMIT,75,"SZR CUYAHOGA FALLS SENIOR LIVING, LLC",Residential Care Facility
SUNRISE OF CUYAHOGA FALLS,OHL03219,2294R,3309298500,cuyahogafalls.ed@sunriseseniorliving.com,1500 STATE ROAD,CUYAHOGA FALLS,OH,44223,SUMMIT,75,"SZR CUYAHOGA FALLS SENIOR LIVING OPCO, LLC",Residential Care Facility
SUNRISE OF CUYAHOGA FALLS,OHL03219,2294R,3309298500,cuyahogafalls.ed@sunriseseniorliving.com,1500 STATE ROAD,CUYAHOGA FALLS,OH,44223,SUMMIT,75,AL INVESTORS-MIDDLEBURG HEIGHTS LLC,Residential Care Facility
SUNRISE OF DUBLIN,OHL41887,2711R,6147182062,dublin.ed@sunriseseniorliving.com,4175 STONERIDGE LANE,DUBLIN,OH,43017,FRANKLIN,120,"SUNRISE DUBLIN SENIOR LIVING, LLC",Residential Care Facility
SUNRISE OF DUBLIN,OHL41887,2711R,6147182062,dublin.ed@sunriseseniorliving.com,4175 STONERIDGE LANE,DUBLIN,OH,43017,FRANKLIN,120,"WELLTOWER OPCO GROUP, LLC",Residential Care Facility
SUNRISE OF DUBLIN,OHL41887,2711R,6147182062,dublin.ed@sunriseseniorliving.com,4175 STONERIDGE LANE,DUBLIN,OH,43017,FRANKLIN,120,"SUNRISE DUBLIN SENIOR LIVING OPCO, LLC",Residential Care Facility
SUNRISE OF GAHANNA,OHL01183,2182R,6144189775,gahanna.ed@sunriseseniorliving.com,775 EAST JOHNSTOWN ROAD,GAHANNA,OH,43230,FRANKLIN,64,"SUNRISE THIRD (POOL I), LLC",Residential Care Facility
SUNRISE OF GAHANNA,OHL01183,2182R,6144189775,gahanna.ed@sunriseseniorliving.com,775 EAST JOHNSTOWN ROAD,GAHANNA,OH,43230,FRANKLIN,64,"WELLTOWER OPCO GROUP, LLC",Residential Care Facility
SUNSET HOUSE,OHL500075,0051R,4195364645,jbishop@sunset-communities.org,4020 INDIAN ROAD,TOLEDO,OH,43606,LUCAS,77,"SUNSET RETIREMENT COMMUNITIES, INC.",Residential Care Facility
SUNSET VILLAGE,OHL500090,2342R,4197241200,cblackmore@sunset-village.org,9640 SYLVANIA-METAMORA ROAD,SYLVANIA,OH,43560,LUCAS,64,WOODLANDS AT SUNSET HOUSE,Residential Care Facility
SUNSET VILLAGE,OHL500090,2342R,4197241200,cblackmore@sunset-village.org,9640 SYLVANIA-METAMORA ROAD,SYLVANIA,OH,43560,LUCAS,64,"SUNSET RETIREMENT COMMUNITIES, INC.",Residential Care Facility
